comment_id,language,category,comment,english_translation
C061508,Roman Telugu,Hate Speech,"Chudu, Adavallaki sontha opinion undadu, evaro cheppindi vaadataru Idi final.","look, women don't have their own opinions, they just repeat what someone told them this is final."
C061510,Telugu,Hate Speech,ఫెమినిస్టులు వల్లే సమాజం పాడైపోతుంది నమ్ము నన్ను.,feminists are ruining society trust me.
C061513,Roman Telugu,Hate Speech,"Urike cheptunna, Vallaki eppudu victim card play cheyadame telusu Seriously-ga.","just saying, they only know how to play the victim card all the time seriously."
C061521,Telugu,Hate Speech,"మావా, ఇలాంటి కంటెంట్ పెట్టేవాళ్ళు అందరూ ఒకే రకం అంతే. 😤","bro, everyone who posts content like this is the same kind that's it."
C061531,Telugu,Offensive,"చూడు, ఏం బుద్ధి లేకుండా మాట్లాడతావ్ నువ్వు సీరియస్‌గా. ...","look, you talk with absolutely no sense seriously."
C061532,Roman Telugu,Hate Speech,"Mava, Ilanti vallani seriously-ga theesukovalsina avasarame ledu Seriously-ga. 😔","bro, there's no need to take people like this seriously at all seriously."
C061538,Roman Telugu,Offensive,"Ila chudu, Ilanti chettha aalochanalu ekkada nerchukunnav Seriously-ga. #WomenSafety","see here, where did you learn such trashy thinking seriously."
C061540,Telugu,Hate Speech,"మావా, ఆడవాళ్ళు ఇంట్లో ఉండాలి, ఆన్‌లైన్‌కి రావద్దు అంతే. 😡","bro, women should stay home, not come online that's it."
C061543,Telugu,Offensive,"విను, నీ లెవెల్ చూస్తే జాలిగా ఉంది నిజంగా. 🙄","listen, seeing your level is honestly pitiful really."
C061547,Roman Telugu,Hate Speech,"Okka maata, Ee generation adavallu respect ivvadaniki asalu arhulu kaadu Idi final. 😡","one thing, this generation of women don't even deserve respect this is final."
C061554,Roman Telugu,Offensive,Neelanti vallaki attention ivvakudadu asalu Arthamaindha?,people like you shouldn't be given any attention at all got it?
C061555,Telugu,Hate Speech,"ఏయ్, వీళ్ళందరూ ఒక్కటే, అటెన్షన్ కోసమే ఇదంతా చేస్తారు నమ్ము నన్ను. ??","hey, they're all the same, doing all this just for attention trust me."
C061558,Telugu,Hate Speech,"చూడు, ఆడవాళ్ళకి నెట్ యాక్సెస్ ఇవ్వడమే పెద్ద తప్పు 🔥","look, giving women internet access itself was a big mistake"
C061566,Roman Telugu,Offensive,"Urike cheptunna, Enduku antha negative-ga untav eppudu Ok na? 😔","just saying, why are you always so negative ok?"
C061567,Roman Telugu,Hate Speech,"Okka maata, Adavallu social media-lo undakudadu Idi final. #WomenSafety","one thing, women shouldn't even be on social media this is final."
C061572,Roman Telugu,Offensive,"Mava, Nee comments chadivithe thalanoppi vastundi Arthamaindha? 😢","bro, reading your comments gives me a headache got it?"
C061575,Telugu,Offensive,"నిజం చెప్పాలంటే, నువ్వు మాట్లాడేముందు కాస్త ఆలోచించు నిజంగా. !!!","honestly, think a little before you speak really."
C061577,Telugu,Offensive,"ఒక్క మాట, నీలాంటి వాళ్ళకి అటెన్షన్ ఇవ్వకూడదు అసలు సీరియస్‌గా. !!!","one thing, people like you shouldn't be given any attention at all seriously."
C061578,Telugu,Offensive,"విను, వెధవ లాజిక్‌తో ఎప్పుడూ ఇలాంటి పోస్టులే పెడతావ్ ఇది నిజం. ...","listen, with that stupid logic you always post nonsense like this this is true."
C061579,Telugu,Hate Speech,"మావా, వీళ్ళందరూ ఒక్కటే, అటెన్షన్ కోసమే ఇదంతా చేస్తారు 😔","bro, they're all the same, doing all this just for attention"
C061580,Roman Telugu,Hate Speech,"Hey, Ilanti content pettevallu andaru oke rakam Idi nijam.","hey, everyone who posts content like this is the same kind this is true."
C061582,Telugu,Offensive,"ఒక్క మాట, నీలాంటి వాళ్ళు వల్లే సోషల్ మీడియా పాడైపోయింది నమ్ము నన్ను. smh","one thing, people like you have ruined social media trust me."
C061593,Telugu,Offensive,"బై ద వే, నీలాంటి వాళ్ళు వల్లే సోషల్ మీడియా పాడైపోయింది నిజంగా. 😤","by the way, people like you have ruined social media really."
C061600,Telugu,Offensive,ఎవడు అడిగాడు నీ ఒపీనియన్ సీరియస్‌గా.,who asked for your opinion seriously.
C061602,Roman Telugu,Offensive,"Hey, Evadu adigadu nee opinion Nijanga. ??","hey, who asked for your opinion really."
C061608,Roman Telugu,Hate Speech,"Chudu, Adavallaki net access ivvadame pedda tappu Gurthu pettuko. ??","look, giving women internet access itself was a big mistake remember this."
C061610,Roman Telugu,Hate Speech,"Chudu, Adavallu intlo undali, online-ki ravaddu Seriously-ga. 😡","look, women should stay home, not come online seriously."
C061615,Telugu,Hate Speech,"ఏయ్, ఆడవాళ్ళకి నెట్ యాక్సెస్ ఇవ్వడమే పెద్ద తప్పు అంతే. 🔥","hey, giving women internet access itself was a big mistake that's it."
C061622,Telugu,Offensive,"ఇలా చూడు, నోరు మూసుకో, నీకు సంబంధం లేదు ఇందులో నమ్ము నన్ను. ...","see here, shut your mouth, this has nothing to do with you trust me."
C061623,Roman Telugu,Hate Speech,"Vinu, Adavallaki net access ivvadame pedda tappu !!!","listen, giving women internet access itself was a big mistake"
C061629,Telugu,Offensive,"ఏయ్, ఇది చూసి నవ్వాలో ఏడవాలో అర్థం కావట్లేదు నమ్ము నన్ను. 😡","hey, don't know whether to laugh or cry seeing this trust me."
C061631,Roman Telugu,Hate Speech,"Nijam cheppalante, Feminists valle samajam padaipotundi 😤","honestly, feminists are ruining society"
C061633,Telugu,Hate Speech,"నిజం చెప్పాలంటే, వీళ్ళకి ఎప్పుడూ ఏదో ఒక కంప్లైంట్ ఉంటుంది అంతే 🙄","honestly, they always have some complaint or the other, that's it"
C061634,Roman Telugu,Hate Speech,"Chudu, Adavallaki sontha opinion undadu, evaro cheppindi vaadataru Idi nijam. 😢","look, women don't have their own opinions, they just repeat what someone told them this is true."
C061635,Roman Telugu,Hate Speech,"Okka maata, Ilanti adavalle asalu samasyalaki karanam Idi final. ??","one thing, women like these are the real cause of problems this is final."
C061638,Telugu,Offensive,"నిజం చెప్పాలంటే, ఏం బుద్ధి లేకుండా మాట్లాడతావ్ నువ్వు ఓకే నా? !!!","honestly, you talk with absolutely no sense ok?"
C061641,Roman Telugu,Hate Speech,"Chudu, Ilanti vallani seriously-ga theesukovalsina avasarame ledu 😢","look, there's no need to take people like this seriously at all"
C061645,Roman Telugu,Hate Speech,"Okka maata, Adavallaki nijanga samanatvam akkarledu, prathyeka sadupayale kavali Arthamaindha? 😢","one thing, women don't really want equality, they just want special treatment got it?"
C061657,Telugu,Hate Speech,"ఏయ్, ఆడవాళ్ళకి నిజంగా సమానత్వం అక్కర్లేదు, ప్రత్యేక సదుపాయాలే కావాలి","hey, women don't really want equality, they just want special treatment"
C061668,Telugu,Hate Speech,"ఊరికే చెప్తున్నా, ఆడవాళ్ళకి బుద్ధి ఉండదు అందుకే ఇలా పోస్ట్ చేస్తారు ఇది ఫైనల్. 🔥","just saying, women have no sense, that's why they post like this this is final."
C061671,Roman Telugu,Offensive,"Okka maata, Nee comments chadivithe thalanoppi vastundi Idi final. ...","one thing, reading your comments gives me a headache this is final."
C061673,Telugu,Hate Speech,"ఒక్క మాట, ఆడవాళ్ళు ఇంట్లో ఉండాలి, ఆన్‌లైన్‌కి రావద్దు నిజంగా. 😡","one thing, women should stay home, not come online really."
C061676,Telugu,Hate Speech,"ఏయ్, ఆడవాళ్ళు ఎప్పుడూ ఓవర్‌గా రియాక్ట్ అవుతారు గుర్తు పెట్టుకో. !!!","hey, women always overreact remember this."
C061683,Telugu,Hate Speech,"బై ద వే, ఇలాంటి కంటెంట్ పెట్టేవాళ్ళు అందరూ ఒకే రకం నిజంగా. 😡","by the way, everyone who posts content like this is the same kind really."
C061685,Telugu,Offensive,నీ లెవెల్ చూస్తే జాలిగా ఉంది అర్థమైందా? smh,seeing your level is honestly pitiful got it?
C061686,Telugu,Offensive,"బై ద వే, ఇలాంటి చెత్త ఆలోచనలు ఎక్కడ నేర్చుకున్నావ్ నిజంగా.","by the way, where did you learn such trashy thinking really."
C061689,Roman Telugu,Offensive,Nee comments chadivithe thalanoppi vastundi,reading your comments gives me a headache
C061690,Roman Telugu,Offensive,"Okka maata, Neeku burra ledha ila maatladatavu Anthe. ...","one thing, have you lost your mind, talking like this that's it."
C061693,Telugu,Hate Speech,"చూడు, ఆడవాళ్ళకి నెట్ యాక్సెస్ ఇవ్వడమే పెద్ద తప్పు గుర్తు పెట్టుకో. #WomenSafety","look, giving women internet access itself was a big mistake remember this."
C061700,Telugu,Hate Speech,"ఒక్క మాట, ఆడవాళ్ళు సోషల్ మీడియాలో ఉండకూడదు సీరియస్‌గా. 🔥","one thing, women shouldn't even be on social media seriously."
C061701,Roman Telugu,Hate Speech,"Mava, Ilanti adavalle asalu samasyalaki karanam Anthe.","bro, women like these are the real cause of problems that's it."
C061702,Roman Telugu,Offensive,Inta chettha video eppudu chudaledu Ok na? 😢,never seen such a trash video ok?
C061706,Telugu,Hate Speech,"మావా, వీళ్ళందరూ ఒక్కటే, అటెన్షన్ కోసమే ఇదంతా చేస్తారు అర్థమైందా? 🔥","bro, they're all the same, doing all this just for attention got it?"
C061707,Roman Telugu,Hate Speech,"Ila chudu, Adavallaki sontha opinion undadu, evaro cheppindi vaadataru Seriously-ga. ...","see here, women don't have their own opinions, they just repeat what someone told them seriously."
C061709,Roman Telugu,Offensive,"Okka maata, Inta chettha video eppudu chudaledu Arthamaindha? 🙄","one thing, never seen such a trash video got it?"
C061712,Roman Telugu,Hate Speech,Adavallu social media-lo undakudadu Gurthu pettuko.,women shouldn't even be on social media remember this.
C061713,Telugu,Offensive,"ఏయ్, దీనికేమైనా అర్థం ఉందా, వేస్ట్ ఆఫ్ టైమ్ ఇది నిజం. 🙄","hey, does this even make sense, total waste of time this is true."
C061718,Roman Telugu,Offensive,"By the way, Nuvvu maatladedi eppudu artham lekunda untundi Gurthu pettuko.","by the way, what you say never makes any sense remember this."
C061719,Telugu,Hate Speech,"చూడు, ఆడవాళ్ళకి బుద్ధి ఉండదు అందుకే ఇలా పోస్ట్ చేస్తారు సీరియస్‌గా.","look, women have no sense, that's why they post like this seriously."
C061726,Roman Telugu,Hate Speech,"Vellandaru okkate, attention kosame idantha chestaru Seriously-ga. ...","they're all the same, doing all this just for attention seriously."
C061730,Telugu,Offensive,"ఇలా చూడు, వెధవ లాజిక్‌తో ఎప్పుడూ ఇలాంటి పోస్టులే పెడతావ్ సీరియస్‌గా. ??","see here, with that stupid logic you always post nonsense like this seriously."
C061736,Roman Telugu,Offensive,"Okka maata, Diniki emaina artham unda, waste of time Idi nijam. ??","one thing, does this even make sense, total waste of time this is true."
C061739,Roman Telugu,Offensive,"Chudu, Inta chettha video eppudu chudaledu Anthe.","look, never seen such a trash video that's it."
C061741,Roman Telugu,Offensive,"By the way, Nuvvu maatladeముందు kaastha aalochinchu Arthamaindha?","by the way, think a little before you speak got it?"
C061755,Telugu,Offensive,"మావా, నోరు మూసుకో, నీకు సంబంధం లేదు ఇందులో సీరియస్‌గా. ...","bro, shut your mouth, this has nothing to do with you seriously."
C061758,Roman Telugu,Hate Speech,"Chudu, Adavallaki net access ivvadame pedda tappu Seriously-ga.","look, giving women internet access itself was a big mistake seriously."
C061760,Telugu,Hate Speech,"బై ద వే, ఇలాంటి కంటెంట్ పెట్టేవాళ్ళు అందరూ ఒకే రకం సీరియస్‌గా.","by the way, everyone who posts content like this is the same kind seriously."
C061763,Telugu,Offensive,"మావా, దీని కంటే బెటర్ కంటెంట్ ఎక్కడైనా దొరుకుతుంది ఇది ఫైనల్. ...","bro, you can find better content anywhere than this this is final."
C061765,Telugu,Hate Speech,"మావా, వీళ్ళకి ఎప్పుడూ ఏదో ఒక కంప్లైంట్ ఉంటుంది అంతే ఇది ఫైనల్. !!!","bro, they always have some complaint or the other, that's it this is final."
C061766,Roman Telugu,Hate Speech,"Vinu, Ilanti vallani seriously-ga theesukovalsina avasarame ledu Gurthu pettuko.","listen, there's no need to take people like this seriously at all remember this."
C061770,Telugu,Offensive,ఇలాంటి వాళ్ళని చూస్తే జాలి కూడా వేయదు నిజంగా.,seeing people like this doesn't even evoke pity really.
C061771,Roman Telugu,Hate Speech,"Mava, Feminists valle samajam padaipotundi Seriously-ga. smh","bro, feminists are ruining society seriously."
C061782,Roman Telugu,Hate Speech,"Ila chudu, Adavallu social media-lo undakudadu Seriously-ga. 😢","see here, women shouldn't even be on social media seriously."
C061783,Roman Telugu,Offensive,"Chudu, Diniki emaina artham unda, waste of time Nammu nannu. 🙄","look, does this even make sense, total waste of time trust me."
C061785,Roman Telugu,Offensive,"By the way, Inta chettha video eppudu chudaledu 😡","by the way, never seen such a trash video"
C061795,Roman Telugu,Offensive,Ilanti chettha aalochanalu ekkada nerchukunnav Idi final. !!!,where did you learn such trashy thinking this is final.
C061797,Telugu,Offensive,"ఒక్క మాట, ఇది చూసి నవ్వాలో ఏడవాలో అర్థం కావట్లేదు గుర్తు పెట్టుకో. 🔥","one thing, don't know whether to laugh or cry seeing this remember this."
C061807,Telugu,Offensive,ఇలాంటి చెత్త ఆలోచనలు ఎక్కడ నేర్చుకున్నావ్ అంతే. !!!,where did you learn such trashy thinking that's it.
C061812,Roman Telugu,Offensive,"Urike cheptunna, Diniki emaina artham unda, waste of time Idi final.","just saying, does this even make sense, total waste of time this is final."
C061813,Roman Telugu,Hate Speech,"Adavallaki nijanga samanatvam akkarledu, prathyeka sadupayale kavali Ok na?","women don't really want equality, they just want special treatment ok?"
C061814,Telugu,Hate Speech,"చూడు, ఆడవాళ్ళకి బుద్ధి ఉండదు అందుకే ఇలా పోస్ట్ చేస్తారు అర్థమైందా? 😔","look, women have no sense, that's why they post like this got it?"
C061815,Roman Telugu,Offensive,"Okka maata, Nuvvu maatladeముందు kaastha aalochinchu Nijanga. 😔","one thing, think a little before you speak really."
C061819,Roman Telugu,Offensive,"Vinu, Neeku burra ledha ila maatladatavu Idi nijam. ??","listen, have you lost your mind, talking like this this is true."
C061820,Telugu,Offensive,"ఒక్క మాట, ఇది చూసి నవ్వాలో ఏడవాలో అర్థం కావట్లేదు #WomenSafety","one thing, don't know whether to laugh or cry seeing this"
C061822,Roman Telugu,Hate Speech,"Nijam cheppalante, Adavallaki sontha opinion undadu, evaro cheppindi vaadataru Seriously-ga. 🙄","honestly, women don't have their own opinions, they just repeat what someone told them seriously."
C061826,Roman Telugu,Offensive,"Chudu, Inta chettha video eppudu chudaledu Ok na? 😢","look, never seen such a trash video ok?"
C061829,Telugu,Hate Speech,"ఇలా చూడు, ఈ జనరేషన్ ఆడవాళ్ళు రెస్పెక్ట్ ఇవ్వడానికి అసలు అర్హులు కాదు ఇది ఫైనల్. 😤","see here, this generation of women don't even deserve respect this is final."
C061834,Roman Telugu,Hate Speech,"Ila chudu, Ilanti adavalla valle magavallu badhapadedi Ok na? 😤","see here, it's because of women like these that men suffer ok?"
C061836,Telugu,Offensive,"ఊరికే చెప్తున్నా, నీ లెవెల్ చూస్తే జాలిగా ఉంది నమ్ము నన్ను. #WomenSafety","just saying, seeing your level is honestly pitiful trust me."
C061837,Telugu,Hate Speech,"బై ద వే, వీళ్ళు మాట్లాడేది వినడం కూడా టైమ్ వేస్ట్ ఓకే నా?","by the way, even listening to what they say is a waste of time ok?"
C061841,Roman Telugu,Hate Speech,Adavallaki buddhi undadu anduke ila post chestaru Arthamaindha? 🔥,"women have no sense, that's why they post like this got it?"
C061845,Roman Telugu,Hate Speech,"By the way, Vellandaru chesedi kevalam drama-ne Gurthu pettuko. 😤","by the way, all they do is drama remember this."
C061873,Roman Telugu,Hate Speech,"Urike cheptunna, Vallaki eppudu victim card play cheyadame telusu Anthe.","just saying, they only know how to play the victim card all the time that's it."
C061874,Telugu,Offensive,"నిజం చెప్పాలంటే, నీ కామెంట్లు చదివితే తలనొప్పి వస్తుంది నిజంగా. #WomenSafety","honestly, reading your comments gives me a headache really."
C061880,Telugu,Offensive,"ఊరికే చెప్తున్నా, నీలాంటి వాళ్ళు వల్లే సోషల్ మీడియా పాడైపోయింది ఓకే నా? ??","just saying, people like you have ruined social media ok?"
C061883,Telugu,Offensive,"బై ద వే, ఇలాంటి పోస్టులు పెట్టేముందు కామన్‌సెన్స్ వాడు గుర్తు పెట్టుకో. 🙄","by the way, use some common sense before posting things like this remember this."
C061887,Roman Telugu,Offensive,"Vinu, Diniki emaina artham unda, waste of time Ok na?","listen, does this even make sense, total waste of time ok?"
C061888,Roman Telugu,Offensive,"Mava, Dini kante better content ekkadaina dorukutundi Nammu nannu.","bro, you can find better content anywhere than this trust me."
C061894,Telugu,Hate Speech,"ఇలా చూడు, ఆడవాళ్ళకి నిజంగా సమానత్వం అక్కర్లేదు, ప్రత్యేక సదుపాయాలే కావాలి అంతే. #WomenSafety","see here, women don't really want equality, they just want special treatment that's it."
C061896,Roman Telugu,Offensive,"Mava, Ilanti postulu petteముందు common sense vaadu Gurthu pettuko. !!!","bro, use some common sense before posting things like this remember this."
C061902,Roman Telugu,Offensive,"By the way, Ilanti chettha aalochanalu ekkada nerchukunnav Arthamaindha? ...","by the way, where did you learn such trashy thinking got it?"
C061908,Telugu,Offensive,"ఏయ్, ఇది చూసి నవ్వాలో ఏడవాలో అర్థం కావట్లేదు #WomenSafety","hey, don't know whether to laugh or cry seeing this"
C061909,Roman Telugu,Offensive,"Mava, Neeku burra ledha ila maatladatavu Arthamaindha?","bro, have you lost your mind, talking like this got it?"
C061911,Roman Telugu,Offensive,"Urike cheptunna, Neelanti vallu valle social media padaipoyindi Seriously-ga. 😤","just saying, people like you have ruined social media seriously."
C061913,Telugu,Offensive,"చూడు, ఇలాంటి పోస్టులు పెట్టేముందు కామన్‌సెన్స్ వాడు ఇది ఫైనల్. ...","look, use some common sense before posting things like this this is final."
C061919,Roman Telugu,Hate Speech,"Mava, Vellandaru chesedi kevalam drama-ne Seriously-ga. 🔥","bro, all they do is drama seriously."
C061921,Telugu,Offensive,"ఊరికే చెప్తున్నా, ఎందుకు అంత నెగెటివ్‌గా ఉంటావ్ ఎప్పుడూ నమ్ము నన్ను. ??","just saying, why are you always so negative trust me."
C061929,Telugu,Offensive,"నిజం చెప్పాలంటే, నువ్వు మాట్లాడేముందు కాస్త ఆలోచించు 😤","honestly, think a little before you speak"
C061932,Roman Telugu,Offensive,"Nijam cheppalante, Ilanti vallani chuste jaali kuda veyadu Seriously-ga. #WomenSafety","honestly, seeing people like this doesn't even evoke pity seriously."
C061937,Telugu,Hate Speech,"ఒక్క మాట, వీళ్ళు అందరూ ఒకటే గ్రూప్‌లో ఉంటారు, నమ్మడానికి లేదు అంతే.","one thing, they're all part of the same group, can't be trusted that's it."
C061941,Roman Telugu,Offensive,"Chudu, Ilanti chettha aalochanalu ekkada nerchukunnav Arthamaindha? ...","look, where did you learn such trashy thinking got it?"
C061942,Roman Telugu,Offensive,"Urike cheptunna, Ilanti chettha aalochanalu ekkada nerchukunnav ??","just saying, where did you learn such trashy thinking"
C061945,Telugu,Hate Speech,"నిజం చెప్పాలంటే, వీళ్ళకి ఎప్పుడూ విక్టిమ్ కార్డ్ ప్లే చేయడమే తెలుసు ఓకే నా?","honestly, they only know how to play the victim card all the time ok?"
C061946,Roman Telugu,Hate Speech,"Chudu, Ee generation adavallu respect ivvadaniki asalu arhulu kaadu Anthe. 😤","look, this generation of women don't even deserve respect that's it."
C061952,Telugu,Offensive,"ఒక్క మాట, వెధవ లాజిక్‌తో ఎప్పుడూ ఇలాంటి పోస్టులే పెడతావ్ ఓకే నా? ...","one thing, with that stupid logic you always post nonsense like this ok?"
C061956,Telugu,Hate Speech,"విను, ఆడవాళ్ళకి బుద్ధి ఉండదు అందుకే ఇలా పోస్ట్ చేస్తారు అర్థమైందా? ??","listen, women have no sense, that's why they post like this got it?"
C061961,Telugu,Hate Speech,"ఇలా చూడు, ఆడవాళ్ళు సోషల్ మీడియాలో ఉండకూడదు ఇది ఫైనల్. 😤","see here, women shouldn't even be on social media this is final."
C061963,Telugu,Hate Speech,"ఇలా చూడు, ఫెమినిస్టులు వల్లే సమాజం పాడైపోతుంది ఇది ఫైనల్. 🔥","see here, feminists are ruining society this is final."
C061965,Roman Telugu,Hate Speech,"Chudu, Vallu andaru okate group-lo untaru, nammadaniki ledu Anthe. 🙄","look, they're all part of the same group, can't be trusted that's it."
C061968,Roman Telugu,Offensive,"By the way, Neelanti vallu valle social media padaipoyindi Nijanga. 😤","by the way, people like you have ruined social media really."
C061969,Roman Telugu,Offensive,"Urike cheptunna, Dini kante better content ekkadaina dorukutundi Nammu nannu. 😔","just saying, you can find better content anywhere than this trust me."
C061971,Telugu,Offensive,"విను, నువ్వు మాట్లాడేది ఎప్పుడూ అర్థం లేకుండా ఉంటుంది నిజంగా. !!!","listen, what you say never makes any sense really."
