comment_id,language,category,comment,english_translation
C053098,Telugu,Hate Speech,"చూడు, వీళ్ళకి ఎప్పుడూ విక్టిమ్ కార్డ్ ప్లే చేయడమే తెలుసు నమ్ము నన్ను. #WomenSafety","look, they only know how to play the victim card all the time trust me."
C053105,Telugu,Offensive,"మావా, ఇంత చెత్త వీడియో ఎప్పుడూ చూడలేదు నమ్ము నన్ను. 😤","bro, never seen such a trash video trust me."
C053108,Telugu,Hate Speech,"నిజం చెప్పాలంటే, ఈ జనరేషన్ ఆడవాళ్ళు రెస్పెక్ట్ ఇవ్వడానికి అసలు అర్హులు కాదు ఓకే నా? ??","honestly, this generation of women don't even deserve respect ok?"
C053109,Telugu,Hate Speech,"మావా, ఫెమినిస్టులు వల్లే సమాజం పాడైపోతుంది ఓకే నా? 🔥","bro, feminists are ruining society ok?"
C053111,Roman Telugu,Offensive,"Chudu, Neeku burra ledha ila maatladatavu Anthe. !!!","look, have you lost your mind, talking like this that's it."
C053121,Telugu,Hate Speech,"ఊరికే చెప్తున్నా, ఇలాంటి వాళ్ళని సీరియస్‌గా తీసుకోవాల్సిన అవసరమే లేదు ఇది నిజం. 😢","just saying, there's no need to take people like this seriously at all this is true."
C053125,Telugu,Hate Speech,"నిజం చెప్పాలంటే, ఇలాంటి వాళ్ళని సీరియస్‌గా తీసుకోవాల్సిన అవసరమే లేదు అంతే. 😔","honestly, there's no need to take people like this seriously at all that's it."
C053127,Roman Telugu,Offensive,"Ila chudu, Diniki emaina artham unda, waste of time Ok na? ...","see here, does this even make sense, total waste of time ok?"
C053128,Telugu,Offensive,"బై ద వే, దీని కంటే బెటర్ కంటెంట్ ఎక్కడైనా దొరుకుతుంది ఇది ఫైనల్. 😔","by the way, you can find better content anywhere than this this is final."
C053131,Roman Telugu,Hate Speech,"By the way, Adavallu eppudu over-ga react avutharu Nammu nannu. #WomenSafety","by the way, women always overreact trust me."
C053134,Roman Telugu,Hate Speech,"Ila chudu, Ilanti content pettevallu andaru oke rakam 🔥","see here, everyone who posts content like this is the same kind"
C053139,Roman Telugu,Offensive,"Urike cheptunna, Diniki emaina artham unda, waste of time Nammu nannu. ...","just saying, does this even make sense, total waste of time trust me."
C053142,Roman Telugu,Hate Speech,"Mava, Ee generation adavallu respect ivvadaniki asalu arhulu kaadu Seriously-ga. 😢","bro, this generation of women don't even deserve respect seriously."
C053143,Telugu,Hate Speech,"బై ద వే, ఇలాంటి వాళ్ళని సీరియస్‌గా తీసుకోవాల్సిన అవసరమే లేదు ఇది నిజం. ??","by the way, there's no need to take people like this seriously at all this is true."
C053145,Roman Telugu,Offensive,"Nijam cheppalante, Nuvvu maatladeముందు kaastha aalochinchu 😤","honestly, think a little before you speak"
C053148,Telugu,Offensive,"చూడు, వేస్ట్ ఫెలో, ఎందుకు ఇలాంటి పోస్ట్ పెడతావు అర్థమైందా? #WomenSafety","look, waste fellow, why do you post nonsense like this got it?"
C053151,Roman Telugu,Offensive,"Ila chudu, Neelanti vallaki attention ivvakudadu asalu Idi nijam. 🔥","see here, people like you shouldn't be given any attention at all this is true."
C053155,Roman Telugu,Offensive,"Vinu, Em buddhi lekunda maatladatav nuvvu Anthe.","listen, you talk with absolutely no sense that's it."
C053159,Roman Telugu,Offensive,"Nijam cheppalante, Neelanti vallaki attention ivvakudadu asalu Anthe. 😢","honestly, people like you shouldn't be given any attention at all that's it."
C053166,Telugu,Hate Speech,"బై ద వే, ఆడవాళ్ళకి సొంత ఒపీనియన్ ఉండదు, ఎవరో చెప్పింది వాడతారు ఓకే నా? 😡","by the way, women don't have their own opinions, they just repeat what someone told them ok?"
C053168,Roman Telugu,Hate Speech,"Ila chudu, Vallu maatladedi vinadam kuda time waste","see here, even listening to what they say is a waste of time"
C053174,Roman Telugu,Hate Speech,"Mava, Adavallu intlo undali, online-ki ravaddu Seriously-ga.","bro, women should stay home, not come online seriously."
C053179,Telugu,Hate Speech,"నిజం చెప్పాలంటే, వీళ్ళు అందరూ ఒకటే గ్రూప్‌లో ఉంటారు, నమ్మడానికి లేదు గుర్తు పెట్టుకో. !!!","honestly, they're all part of the same group, can't be trusted remember this."
C053183,Roman Telugu,Offensive,"Okka maata, Nee level chuste jaaliga undi Ok na? 😢","one thing, seeing your level is honestly pitiful ok?"
C053185,Telugu,Hate Speech,ఆడవాళ్ళకి నెట్ యాక్సెస్ ఇవ్వడమే పెద్ద తప్పు !!!,giving women internet access itself was a big mistake
C053186,Roman Telugu,Offensive,"Mava, Ilanti postulu petteముందు common sense vaadu Arthamaindha? 🔥","bro, use some common sense before posting things like this got it?"
C053188,Roman Telugu,Hate Speech,Adavallu eppudu over-ga react avutharu Seriously-ga.,women always overreact seriously.
C053189,Roman Telugu,Hate Speech,"Chudu, Adavallu intlo undali, online-ki ravaddu 🙄","look, women should stay home, not come online"
C053193,Roman Telugu,Offensive,Em buddhi lekunda maatladatav nuvvu Ok na? ...,you talk with absolutely no sense ok?
C053201,Roman Telugu,Hate Speech,"Urike cheptunna, Vallu andaru okate group-lo untaru, nammadaniki ledu Arthamaindha? !!!","just saying, they're all part of the same group, can't be trusted got it?"
C053204,Telugu,Hate Speech,ఆడవాళ్ళ మాటలు ఎప్పుడూ నమ్మకూడదు అసలు ఓకే నా? 🙄,you should never trust what women say ok?
C053206,Telugu,Offensive,"ఒక్క మాట, నీలాంటి వాళ్ళకి అటెన్షన్ ఇవ్వకూడదు అసలు నిజంగా. ...","one thing, people like you shouldn't be given any attention at all really."
C053209,Telugu,Hate Speech,ఈ జనరేషన్ ఆడవాళ్ళు రెస్పెక్ట్ ఇవ్వడానికి అసలు అర్హులు కాదు ఇది ఫైనల్. 😢,this generation of women don't even deserve respect this is final.
C053210,Roman Telugu,Offensive,"Urike cheptunna, Neeku burra ledha ila maatladatavu Ok na? smh","just saying, have you lost your mind, talking like this ok?"
C053211,Telugu,Hate Speech,"ఒక్క మాట, ఆడవాళ్ళకి బుద్ధి ఉండదు అందుకే ఇలా పోస్ట్ చేస్తారు అంతే.","one thing, women have no sense, that's why they post like this that's it."
C053214,Roman Telugu,Offensive,"Nijam cheppalante, Ilanti chettha aalochanalu ekkada nerchukunnav Nijanga. #WomenSafety","honestly, where did you learn such trashy thinking really."
C053218,Telugu,Offensive,"నిజం చెప్పాలంటే, నీకు బుర్ర లేదా ఇలా మాట్లాడతావు సీరియస్‌గా. 😢","honestly, have you lost your mind, talking like this seriously."
C053220,Telugu,Offensive,"ఒక్క మాట, ఇలాంటి చెత్త ఆలోచనలు ఎక్కడ నేర్చుకున్నావ్ నమ్ము నన్ను. ??","one thing, where did you learn such trashy thinking trust me."
C053225,Telugu,Hate Speech,"మావా, వీళ్ళు మాట్లాడేది వినడం కూడా టైమ్ వేస్ట్ అంతే. #WomenSafety","bro, even listening to what they say is a waste of time that's it."
C053227,Telugu,Offensive,"ఏయ్, నీలాంటి వాళ్ళకి అటెన్షన్ ఇవ్వకూడదు అసలు ??","hey, people like you shouldn't be given any attention at all"
C053230,Telugu,Offensive,"బై ద వే, దీనికేమైనా అర్థం ఉందా, వేస్ట్ ఆఫ్ టైమ్ ఇది నిజం.","by the way, does this even make sense, total waste of time this is true."
C053232,Roman Telugu,Offensive,"Vinu, Enduku antha negative-ga untav eppudu Arthamaindha? smh","listen, why are you always so negative got it?"
C053234,Roman Telugu,Offensive,"Hey, Inta chettha video eppudu chudaledu Anthe. 😔","hey, never seen such a trash video that's it."
C053236,Roman Telugu,Hate Speech,"Nijam cheppalante, Adavallaki nijanga samanatvam akkarledu, prathyeka sadupayale kavali Anthe. 😤","honestly, women don't really want equality, they just want special treatment that's it."
C053243,Telugu,Hate Speech,"నిజం చెప్పాలంటే, ఈ జనరేషన్ ఆడవాళ్ళు రెస్పెక్ట్ ఇవ్వడానికి అసలు అర్హులు కాదు ఓకే నా? 🔥","honestly, this generation of women don't even deserve respect ok?"
C053245,Telugu,Offensive,"చూడు, ఇలాంటి చెత్త ఆలోచనలు ఎక్కడ నేర్చుకున్నావ్ అర్థమైందా? !!!","look, where did you learn such trashy thinking got it?"
C053251,Roman Telugu,Offensive,Nee comments chadivithe thalanoppi vastundi Gurthu pettuko.,reading your comments gives me a headache remember this.
C053253,Roman Telugu,Offensive,"Mava, Vedhava logic-tho eppudu ilanti postule pedatav Seriously-ga. 😔","bro, with that stupid logic you always post nonsense like this seriously."
C053254,Roman Telugu,Hate Speech,"Nijam cheppalante, Adavallaki net access ivvadame pedda tappu Nijanga. 😢","honestly, giving women internet access itself was a big mistake really."
C053261,Roman Telugu,Offensive,"Hey, Nuvvu maatladedi eppudu artham lekunda untundi Nammu nannu. #WomenSafety","hey, what you say never makes any sense trust me."
C053269,Roman Telugu,Hate Speech,"Okka maata, Ee generation adavallu respect ivvadaniki asalu arhulu kaadu Nijanga. 🙄","one thing, this generation of women don't even deserve respect really."
C053271,Roman Telugu,Offensive,"By the way, Neelanti vallu valle social media padaipoyindi Idi final. 😤","by the way, people like you have ruined social media this is final."
C053279,Telugu,Offensive,నీకు బుర్ర లేదా ఇలా మాట్లాడతావు ఓకే నా? 😤,"have you lost your mind, talking like this ok?"
C053280,Telugu,Hate Speech,"ఏయ్, ఇలాంటి వాళ్ళని సీరియస్‌గా తీసుకోవాల్సిన అవసరమే లేదు సీరియస్‌గా.","hey, there's no need to take people like this seriously at all seriously."
C053281,Telugu,Hate Speech,"బై ద వే, వీళ్ళందరూ చేసేది కేవలం డ్రామానే అంతే. smh","by the way, all they do is drama that's it."
C053290,Roman Telugu,Offensive,"Hey, Em buddhi lekunda maatladatav nuvvu Gurthu pettuko. ??","hey, you talk with absolutely no sense remember this."
C053291,Roman Telugu,Hate Speech,"By the way, Vallaki eppudu edo oka complaint untundi anthe Seriously-ga. ...","by the way, they always have some complaint or the other, that's it seriously."
C053296,Roman Telugu,Offensive,"Chudu, Dini kante better content ekkadaina dorukutundi Arthamaindha? 😡","look, you can find better content anywhere than this got it?"
C053307,Roman Telugu,Offensive,"Ila chudu, Dini kante better content ekkadaina dorukutundi Arthamaindha? 😔","see here, you can find better content anywhere than this got it?"
C053308,Roman Telugu,Hate Speech,"Nijam cheppalante, Vellandaru okkate, attention kosame idantha chestaru Seriously-ga. smh","honestly, they're all the same, doing all this just for attention seriously."
C053329,Roman Telugu,Hate Speech,"Mava, Adavallaki net access ivvadame pedda tappu Idi final. !!!","bro, giving women internet access itself was a big mistake this is final."
C053330,Telugu,Hate Speech,"ఒక్క మాట, ఆడవాళ్ళకి సొంత ఒపీనియన్ ఉండదు, ఎవరో చెప్పింది వాడతారు నమ్ము నన్ను.","one thing, women don't have their own opinions, they just repeat what someone told them trust me."
C053333,Roman Telugu,Offensive,"Chudu, Neelanti vallu valle social media padaipoyindi Gurthu pettuko.","look, people like you have ruined social media remember this."
C053337,Telugu,Hate Speech,"బై ద వే, వీళ్ళందరూ ఒక్కటే, అటెన్షన్ కోసమే ఇదంతా చేస్తారు నిజంగా. #WomenSafety","by the way, they're all the same, doing all this just for attention really."
C053338,Telugu,Hate Speech,"ఊరికే చెప్తున్నా, ఆడవాళ్ళు ఎప్పుడూ ఓవర్‌గా రియాక్ట్ అవుతారు ఇది నిజం.","just saying, women always overreact this is true."
C053340,Roman Telugu,Hate Speech,"Urike cheptunna, Adavallaki buddhi undadu anduke ila post chestaru Nammu nannu. #WomenSafety","just saying, women have no sense, that's why they post like this trust me."
C053345,Roman Telugu,Offensive,"Urike cheptunna, Vedhava logic-tho eppudu ilanti postule pedatav Nammu nannu. 😡","just saying, with that stupid logic you always post nonsense like this trust me."
C053346,Telugu,Offensive,"మావా, నీలాంటి వాళ్ళకి అటెన్షన్ ఇవ్వకూడదు అసలు ఇది నిజం. #WomenSafety","bro, people like you shouldn't be given any attention at all this is true."
C053351,Roman Telugu,Offensive,"Mava, Dini kante better content ekkadaina dorukutundi Nijanga. 😤","bro, you can find better content anywhere than this really."
C053354,Roman Telugu,Hate Speech,Ee generation adavallu respect ivvadaniki asalu arhulu kaadu Nijanga. 🙄,this generation of women don't even deserve respect really.
C053355,Telugu,Offensive,"ఇలా చూడు, నీలాంటి వాళ్ళకి అటెన్షన్ ఇవ్వకూడదు అసలు అంతే.","see here, people like you shouldn't be given any attention at all that's it."
C053363,Telugu,Offensive,"ఏయ్, నీలాంటి వాళ్ళు వల్లే సోషల్ మీడియా పాడైపోయింది #WomenSafety","hey, people like you have ruined social media"
C053369,Telugu,Hate Speech,"మావా, ఆడవాళ్ళు ఇంట్లో ఉండాలి, ఆన్‌లైన్‌కి రావద్దు ఓకే నా? smh","bro, women should stay home, not come online ok?"
C053370,Telugu,Hate Speech,"విను, ఫెమినిస్టులు వల్లే సమాజం పాడైపోతుంది ఓకే నా? 😔","listen, feminists are ruining society ok?"
C053379,Telugu,Hate Speech,"చూడు, వీళ్ళందరూ ఒక్కటే, అటెన్షన్ కోసమే ఇదంతా చేస్తారు smh","look, they're all the same, doing all this just for attention"
C053380,Telugu,Hate Speech,"మావా, వీళ్ళందరూ చేసేది కేవలం డ్రామానే గుర్తు పెట్టుకో. 🔥","bro, all they do is drama remember this."
C053385,Roman Telugu,Hate Speech,"Vinu, Ee generation adavallu respect ivvadaniki asalu arhulu kaadu Idi nijam. 🔥","listen, this generation of women don't even deserve respect this is true."
C053386,Telugu,Hate Speech,"మావా, ఇలాంటి వాళ్ళని సీరియస్‌గా తీసుకోవాల్సిన అవసరమే లేదు ఇది ఫైనల్.","bro, there's no need to take people like this seriously at all this is final."
C053388,Telugu,Offensive,"వేస్ట్ ఫెలో, ఎందుకు ఇలాంటి పోస్ట్ పెడతావు ఓకే నా? 😔","waste fellow, why do you post nonsense like this ok?"
C053392,Telugu,Hate Speech,"నిజం చెప్పాలంటే, వీళ్ళు మాట్లాడేది వినడం కూడా టైమ్ వేస్ట్ ఓకే నా? 😡","honestly, even listening to what they say is a waste of time ok?"
C053395,Telugu,Hate Speech,"నిజం చెప్పాలంటే, ఆడవాళ్ళు ఇంట్లో ఉండాలి, ఆన్‌లైన్‌కి రావద్దు ఇది ఫైనల్. 🙄","honestly, women should stay home, not come online this is final."
C053398,Telugu,Hate Speech,"నిజం చెప్పాలంటే, వీళ్ళందరూ ఒక్కటే, అటెన్షన్ కోసమే ఇదంతా చేస్తారు ఇది ఫైనల్. 🔥","honestly, they're all the same, doing all this just for attention this is final."
C053402,Telugu,Hate Speech,"మావా, ఆడవాళ్ళు ఇంట్లో ఉండాలి, ఆన్‌లైన్‌కి రావద్దు ఓకే నా? 😔","bro, women should stay home, not come online ok?"
C053404,Telugu,Hate Speech,"విను, ఇలాంటి ఆడవాళ్ళే అసలు సమస్యలకి కారణం నిజంగా. smh","listen, women like these are the real cause of problems really."
C053405,Roman Telugu,Hate Speech,"Urike cheptunna, Ilanti vallani seriously-ga theesukovalsina avasarame ledu Nijanga. smh","just saying, there's no need to take people like this seriously at all really."
C053411,Telugu,Hate Speech,"ఒక్క మాట, వీళ్ళందరూ ఒక్కటే, అటెన్షన్ కోసమే ఇదంతా చేస్తారు ఓకే నా? 😔","one thing, they're all the same, doing all this just for attention ok?"
C053415,Roman Telugu,Hate Speech,"Hey, Adavallaki net access ivvadame pedda tappu Seriously-ga. 🙄","hey, giving women internet access itself was a big mistake seriously."
C053418,Roman Telugu,Hate Speech,"Ila chudu, Adavallu social media-lo undakudadu Nijanga.","see here, women shouldn't even be on social media really."
C053422,Roman Telugu,Hate Speech,"Okka maata, Vallaki eppudu victim card play cheyadame telusu Anthe. #WomenSafety","one thing, they only know how to play the victim card all the time that's it."
C053423,Roman Telugu,Offensive,"Okka maata, Nee level chuste jaaliga undi Ok na? ??","one thing, seeing your level is honestly pitiful ok?"
C053433,Telugu,Offensive,"నిజం చెప్పాలంటే, ఎవడు అడిగాడు నీ ఒపీనియన్ సీరియస్‌గా. 😔","honestly, who asked for your opinion seriously."
C053435,Roman Telugu,Hate Speech,"Mava, Feminists valle samajam padaipotundi Anthe. 😢","bro, feminists are ruining society that's it."
C053438,Roman Telugu,Offensive,"Mava, Noru moosuko, neeku sambandham ledu idulo Idi final. 😡","bro, shut your mouth, this has nothing to do with you this is final."
C053447,Telugu,Offensive,"చూడు, దీని కంటే బెటర్ కంటెంట్ ఎక్కడైనా దొరుకుతుంది నమ్ము నన్ను. 😔","look, you can find better content anywhere than this trust me."
C053457,Telugu,Offensive,"మావా, నువ్వు మాట్లాడేది ఎప్పుడూ అర్థం లేకుండా ఉంటుంది నమ్ము నన్ను. ??","bro, what you say never makes any sense trust me."
C053461,Roman Telugu,Hate Speech,"Ila chudu, Vallu andaru okate group-lo untaru, nammadaniki ledu Anthe. 😔","see here, they're all part of the same group, can't be trusted that's it."
C053463,Roman Telugu,Offensive,"Okka maata, Noru moosuko, neeku sambandham ledu idulo Nijanga. 😤","one thing, shut your mouth, this has nothing to do with you really."
C053466,Telugu,Offensive,"ఊరికే చెప్తున్నా, నువ్వు మాట్లాడేది ఎప్పుడూ అర్థం లేకుండా ఉంటుంది ఇది నిజం. 😢","just saying, what you say never makes any sense this is true."
C053467,Roman Telugu,Offensive,"Ila chudu, Ilanti postulu petteముందు common sense vaadu Idi nijam. 😢","see here, use some common sense before posting things like this this is true."
C053470,Telugu,Offensive,"ఊరికే చెప్తున్నా, దీనికేమైనా అర్థం ఉందా, వేస్ట్ ఆఫ్ టైమ్ ఇది ఫైనల్. 🔥","just saying, does this even make sense, total waste of time this is final."
C053479,Roman Telugu,Hate Speech,Ilanti vallani seriously-ga theesukovalsina avasarame ledu Ok na? #WomenSafety,there's no need to take people like this seriously at all ok?
C053484,Roman Telugu,Hate Speech,"By the way, Adavallu intlo undali, online-ki ravaddu","by the way, women should stay home, not come online"
C053486,Telugu,Offensive,"ఒక్క మాట, నీ కామెంట్లు చదివితే తలనొప్పి వస్తుంది నిజంగా. smh","one thing, reading your comments gives me a headache really."
C053504,Telugu,Hate Speech,"నిజం చెప్పాలంటే, ఆడవాళ్ళు ఇంట్లో ఉండాలి, ఆన్‌లైన్‌కి రావద్దు ఓకే నా? 😢","honestly, women should stay home, not come online ok?"
C053505,Roman Telugu,Hate Speech,"Hey, Vallu andaru okate group-lo untaru, nammadaniki ledu Arthamaindha? ...","hey, they're all part of the same group, can't be trusted got it?"
C053511,Roman Telugu,Hate Speech,"Urike cheptunna, Ilanti adavalla valle magavallu badhapadedi Seriously-ga. 😢","just saying, it's because of women like these that men suffer seriously."
C053516,Roman Telugu,Offensive,"Urike cheptunna, Inta chettha video eppudu chudaledu Arthamaindha? ...","just saying, never seen such a trash video got it?"
C053518,Roman Telugu,Hate Speech,"By the way, Adavallu intlo undali, online-ki ravaddu Idi nijam.","by the way, women should stay home, not come online this is true."
C053521,Telugu,Hate Speech,"ఏయ్, ఆడవాళ్ళకి నెట్ యాక్సెస్ ఇవ్వడమే పెద్ద తప్పు గుర్తు పెట్టుకో.","hey, giving women internet access itself was a big mistake remember this."
C053522,Roman Telugu,Offensive,"By the way, Idi chusi navvalo edavalo artham kavatledu Idi final. ...","by the way, don't know whether to laugh or cry seeing this this is final."
C053525,Roman Telugu,Offensive,"Hey, Ilanti chettha aalochanalu ekkada nerchukunnav Idi final. 😔","hey, where did you learn such trashy thinking this is final."
C053530,Telugu,Hate Speech,"ఇలా చూడు, ఇలాంటి కంటెంట్ పెట్టేవాళ్ళు అందరూ ఒకే రకం నమ్ము నన్ను. 😔","see here, everyone who posts content like this is the same kind trust me."
C053532,Roman Telugu,Offensive,"By the way, Nuvvu maatladeముందు kaastha aalochinchu Anthe. #WomenSafety","by the way, think a little before you speak that's it."
C053536,Telugu,Offensive,"బై ద వే, వెధవ లాజిక్‌తో ఎప్పుడూ ఇలాంటి పోస్టులే పెడతావ్ !!!","by the way, with that stupid logic you always post nonsense like this"
C053537,Roman Telugu,Offensive,"Vinu, Evadu adigadu nee opinion Idi final. 😤","listen, who asked for your opinion this is final."
C053552,Telugu,Hate Speech,"బై ద వే, వీళ్ళు అందరూ ఒకటే గ్రూప్‌లో ఉంటారు, నమ్మడానికి లేదు అర్థమైందా? 😤","by the way, they're all part of the same group, can't be trusted got it?"
C053557,Roman Telugu,Hate Speech,"By the way, Vallaki eppudu victim card play cheyadame telusu Seriously-ga.","by the way, they only know how to play the victim card all the time seriously."
C053559,Telugu,Offensive,"విను, నీకు బుర్ర లేదా ఇలా మాట్లాడతావు సీరియస్‌గా. 😔","listen, have you lost your mind, talking like this seriously."
C053562,Telugu,Hate Speech,"చూడు, ఆడవాళ్ళ మాటలు ఎప్పుడూ నమ్మకూడదు అసలు ఇది నిజం. 😔","look, you should never trust what women say this is true."
C053563,Roman Telugu,Offensive,"Mava, Nee comments chadivithe thalanoppi vastundi Anthe.","bro, reading your comments gives me a headache that's it."
C053565,Telugu,Offensive,నీలాంటి వాళ్ళకి అటెన్షన్ ఇవ్వకూడదు అసలు అంతే. 🔥,people like you shouldn't be given any attention at all that's it.
