comment_id,language,category,comment,english_translation
C063823,Roman Telugu,Hate Speech,"Nijam cheppalante, Ee generation adavallu respect ivvadaniki asalu arhulu kaadu Idi final. 😡","honestly, this generation of women don't even deserve respect this is final."
C063825,Telugu,Offensive,"ఊరికే చెప్తున్నా, ఇలాంటి చెత్త ఆలోచనలు ఎక్కడ నేర్చుకున్నావ్ ఓకే నా? 😢","just saying, where did you learn such trashy thinking ok?"
C063826,Telugu,Offensive,"ఏయ్, ఎవడు అడిగాడు నీ ఒపీనియన్ అంతే. 🔥","hey, who asked for your opinion that's it."
C063828,Roman Telugu,Offensive,"Ila chudu, Evadu adigadu nee opinion Anthe. ??","see here, who asked for your opinion that's it."
C063832,Telugu,Hate Speech,"నిజం చెప్పాలంటే, ఇలాంటి ఆడవాళ్ళ వల్లే మగవాళ్ళు బాధపడేది సీరియస్‌గా. ...","honestly, it's because of women like these that men suffer seriously."
C063836,Roman Telugu,Offensive,"Chudu, Diniki emaina artham unda, waste of time Idi nijam. ??","look, does this even make sense, total waste of time this is true."
C063844,Telugu,Offensive,"ఊరికే చెప్తున్నా, ఏం బుద్ధి లేకుండా మాట్లాడతావ్ నువ్వు సీరియస్‌గా.","just saying, you talk with absolutely no sense seriously."
C063852,Roman Telugu,Offensive,"Chudu, Nee level chuste jaaliga undi Seriously-ga. 😤","look, seeing your level is honestly pitiful seriously."
C063854,Roman Telugu,Offensive,Idi chusi navvalo edavalo artham kavatledu Idi nijam. 😡,don't know whether to laugh or cry seeing this this is true.
C063857,Telugu,Hate Speech,"ఇలా చూడు, ఆడవాళ్ళ మాటలు ఎప్పుడూ నమ్మకూడదు అసలు ఇది ఫైనల్.","see here, you should never trust what women say this is final."
C063859,Roman Telugu,Offensive,"Hey, Em buddhi lekunda maatladatav nuvvu Seriously-ga. 🔥","hey, you talk with absolutely no sense seriously."
C063863,Roman Telugu,Offensive,"Mava, Idi chusi navvalo edavalo artham kavatledu Idi final. 😔","bro, don't know whether to laugh or cry seeing this this is final."
C063866,Roman Telugu,Hate Speech,"Ila chudu, Ilanti adavalla valle magavallu badhapadedi Gurthu pettuko.","see here, it's because of women like these that men suffer remember this."
C063867,Roman Telugu,Hate Speech,"Nijam cheppalante, Feminists valle samajam padaipotundi Ok na? 🙄","honestly, feminists are ruining society ok?"
C063869,Telugu,Offensive,"బై ద వే, నీలాంటి వాళ్ళు వల్లే సోషల్ మీడియా పాడైపోయింది నిజంగా. smh","by the way, people like you have ruined social media really."
C063877,Telugu,Hate Speech,"మావా, వీళ్ళకి ఎప్పుడూ ఏదో ఒక కంప్లైంట్ ఉంటుంది అంతే నమ్ము నన్ను. ??","bro, they always have some complaint or the other, that's it trust me."
C063878,Telugu,Hate Speech,"మావా, వీళ్ళకి ఎప్పుడూ విక్టిమ్ కార్డ్ ప్లే చేయడమే తెలుసు ఓకే నా? smh","bro, they only know how to play the victim card all the time ok?"
C063882,Telugu,Hate Speech,"చూడు, ఇలాంటి వాళ్ళని సీరియస్‌గా తీసుకోవాల్సిన అవసరమే లేదు ఓకే నా? 😔","look, there's no need to take people like this seriously at all ok?"
C063886,Roman Telugu,Offensive,Ilanti postulu petteముందు common sense vaadu Arthamaindha?,use some common sense before posting things like this got it?
C063887,Roman Telugu,Hate Speech,"Vellandaru okkate, attention kosame idantha chestaru","they're all the same, doing all this just for attention"
C063888,Roman Telugu,Offensive,"Urike cheptunna, Ilanti postulu petteముందు common sense vaadu Ok na? 😡","just saying, use some common sense before posting things like this ok?"
C063889,Telugu,Offensive,నీకు బుర్ర లేదా ఇలా మాట్లాడతావు ...,"have you lost your mind, talking like this"
C063894,Telugu,Offensive,"నిజం చెప్పాలంటే, నోరు మూసుకో, నీకు సంబంధం లేదు ఇందులో ఇది నిజం.","honestly, shut your mouth, this has nothing to do with you this is true."
C063896,Roman Telugu,Offensive,"Okka maata, Inta chettha video eppudu chudaledu Idi final. 😔","one thing, never seen such a trash video this is final."
C063898,Roman Telugu,Offensive,"Ila chudu, Neelanti vallu valle social media padaipoyindi Idi nijam. #WomenSafety","see here, people like you have ruined social media this is true."
C063903,Roman Telugu,Offensive,"Nijam cheppalante, Vedhava logic-tho eppudu ilanti postule pedatav Idi nijam. #WomenSafety","honestly, with that stupid logic you always post nonsense like this this is true."
C063905,Telugu,Offensive,"బై ద వే, నీలాంటి వాళ్ళకి అటెన్షన్ ఇవ్వకూడదు అసలు అంతే. 🔥","by the way, people like you shouldn't be given any attention at all that's it."
C063907,Telugu,Hate Speech,"ఏయ్, ఇలాంటి ఆడవాళ్ళ వల్లే మగవాళ్ళు బాధపడేది ఇది నిజం. smh","hey, it's because of women like these that men suffer this is true."
C063925,Telugu,Hate Speech,"ఇలా చూడు, ఆడవాళ్ళ మాటలు ఎప్పుడూ నమ్మకూడదు అసలు అర్థమైందా?","see here, you should never trust what women say got it?"
C063937,Telugu,Offensive,"విను, ఎవడు అడిగాడు నీ ఒపీనియన్ అర్థమైందా? #WomenSafety","listen, who asked for your opinion got it?"
C063940,Roman Telugu,Hate Speech,"Nijam cheppalante, Adavalla maatalu eppudu nammakudadu asalu Ok na? !!!","honestly, you should never trust what women say ok?"
C063942,Roman Telugu,Hate Speech,"Mava, Ilanti content pettevallu andaru oke rakam 🙄","bro, everyone who posts content like this is the same kind"
C063943,Roman Telugu,Offensive,"Chudu, Nuvvu maatladedi eppudu artham lekunda untundi Nijanga. #WomenSafety","look, what you say never makes any sense really."
C063944,Telugu,Offensive,"నిజం చెప్పాలంటే, ఇలాంటి చెత్త ఆలోచనలు ఎక్కడ నేర్చుకున్నావ్ నమ్ము నన్ను. 😔","honestly, where did you learn such trashy thinking trust me."
C063951,Roman Telugu,Offensive,"Ila chudu, Neelanti vallu valle social media padaipoyindi Ok na? 😢","see here, people like you have ruined social media ok?"
C063960,Telugu,Offensive,"విను, నువ్వు మాట్లాడేది ఎప్పుడూ అర్థం లేకుండా ఉంటుంది అర్థమైందా? #WomenSafety","listen, what you say never makes any sense got it?"
C063966,Roman Telugu,Hate Speech,"Ila chudu, Adavallaki sontha opinion undadu, evaro cheppindi vaadataru Idi final. 😡","see here, women don't have their own opinions, they just repeat what someone told them this is final."
C063968,Roman Telugu,Hate Speech,"Ila chudu, Adavallu social media-lo undakudadu Ok na? ...","see here, women shouldn't even be on social media ok?"
C063976,Telugu,Hate Speech,"మావా, ఇలాంటి కంటెంట్ పెట్టేవాళ్ళు అందరూ ఒకే రకం సీరియస్‌గా. 😡","bro, everyone who posts content like this is the same kind seriously."
C063985,Roman Telugu,Offensive,"Vinu, Evadu adigadu nee opinion 😢","listen, who asked for your opinion"
C063989,Telugu,Offensive,"నిజం చెప్పాలంటే, నోరు మూసుకో, నీకు సంబంధం లేదు ఇందులో ఇది నిజం. ??","honestly, shut your mouth, this has nothing to do with you this is true."
C063991,Roman Telugu,Offensive,"Chudu, Nuvvu maatladeముందు kaastha aalochinchu Seriously-ga.","look, think a little before you speak seriously."
C064000,Telugu,Offensive,"నిజం చెప్పాలంటే, నువ్వు మాట్లాడేముందు కాస్త ఆలోచించు అర్థమైందా? 🙄","honestly, think a little before you speak got it?"
C064004,Roman Telugu,Offensive,"Nijam cheppalante, Ilanti vallani chuste jaali kuda veyadu Arthamaindha?","honestly, seeing people like this doesn't even evoke pity got it?"
C064005,Roman Telugu,Offensive,"Nijam cheppalante, Neelanti vallu valle social media padaipoyindi Nijanga. 😡","honestly, people like you have ruined social media really."
C064014,Telugu,Hate Speech,"ఊరికే చెప్తున్నా, ఆడవాళ్ళకి నిజంగా సమానత్వం అక్కర్లేదు, ప్రత్యేక సదుపాయాలే కావాలి నిజంగా.","just saying, women don't really want equality, they just want special treatment really."
C064019,Telugu,Hate Speech,"ఇలా చూడు, వీళ్ళకి ఎప్పుడూ విక్టిమ్ కార్డ్ ప్లే చేయడమే తెలుసు నిజంగా. 😡","see here, they only know how to play the victim card all the time really."
C064025,Roman Telugu,Hate Speech,"Adavallaki sontha opinion undadu, evaro cheppindi vaadataru Gurthu pettuko. #WomenSafety","women don't have their own opinions, they just repeat what someone told them remember this."
C064026,Telugu,Hate Speech,"నిజం చెప్పాలంటే, ఆడవాళ్ళకి నెట్ యాక్సెస్ ఇవ్వడమే పెద్ద తప్పు గుర్తు పెట్టుకో. !!!","honestly, giving women internet access itself was a big mistake remember this."
C064028,Roman Telugu,Hate Speech,"Mava, Adavalla maatalu eppudu nammakudadu asalu Nammu nannu. 🔥","bro, you should never trust what women say trust me."
C064034,Roman Telugu,Offensive,"By the way, Ilanti chettha aalochanalu ekkada nerchukunnav Idi final. 😡","by the way, where did you learn such trashy thinking this is final."
C064038,Roman Telugu,Offensive,"Urike cheptunna, Diniki emaina artham unda, waste of time Ok na? ??","just saying, does this even make sense, total waste of time ok?"
C064052,Roman Telugu,Offensive,"Urike cheptunna, Noru moosuko, neeku sambandham ledu idulo Nijanga.","just saying, shut your mouth, this has nothing to do with you really."
C064053,Telugu,Hate Speech,"బై ద వే, ఫెమినిస్టులు వల్లే సమాజం పాడైపోతుంది ??","by the way, feminists are ruining society"
C064065,Telugu,Hate Speech,"నిజం చెప్పాలంటే, ఈ జనరేషన్ ఆడవాళ్ళు రెస్పెక్ట్ ఇవ్వడానికి అసలు అర్హులు కాదు ఓకే నా?","honestly, this generation of women don't even deserve respect ok?"
C064067,Telugu,Hate Speech,"మావా, ఇలాంటి ఆడవాళ్ళే అసలు సమస్యలకి కారణం నిజంగా. #WomenSafety","bro, women like these are the real cause of problems really."
C064069,Telugu,Hate Speech,"విను, ఆడవాళ్ళు ఎప్పుడూ ఓవర్‌గా రియాక్ట్ అవుతారు అర్థమైందా? 😡","listen, women always overreact got it?"
C064071,Telugu,Offensive,"ఒక్క మాట, నీలాంటి వాళ్ళకి అటెన్షన్ ఇవ్వకూడదు అసలు నిజంగా. 🙄","one thing, people like you shouldn't be given any attention at all really."
C064074,Roman Telugu,Hate Speech,"By the way, Ilanti adavalla valle magavallu badhapadedi Anthe. !!!","by the way, it's because of women like these that men suffer that's it."
C064079,Roman Telugu,Hate Speech,"Mava, Adavallaki nijanga samanatvam akkarledu, prathyeka sadupayale kavali Ok na? #WomenSafety","bro, women don't really want equality, they just want special treatment ok?"
C064080,Telugu,Hate Speech,"ఒక్క మాట, ఇలాంటి కంటెంట్ పెట్టేవాళ్ళు అందరూ ఒకే రకం అర్థమైందా? ...","one thing, everyone who posts content like this is the same kind got it?"
C064086,Roman Telugu,Hate Speech,"Hey, Feminists valle samajam padaipotundi","hey, feminists are ruining society"
C064088,Roman Telugu,Offensive,"Noru moosuko, neeku sambandham ledu idulo Ok na?","shut your mouth, this has nothing to do with you ok?"
C064090,Telugu,Offensive,"ఊరికే చెప్తున్నా, నీ కామెంట్లు చదివితే తలనొప్పి వస్తుంది గుర్తు పెట్టుకో. 😤","just saying, reading your comments gives me a headache remember this."
C064092,Telugu,Offensive,"చూడు, నీ లెవెల్ చూస్తే జాలిగా ఉంది నమ్ము నన్ను. smh","look, seeing your level is honestly pitiful trust me."
C064098,Telugu,Hate Speech,"విను, ఇలాంటి వాళ్ళని సీరియస్‌గా తీసుకోవాల్సిన అవసరమే లేదు ఇది ఫైనల్. #WomenSafety","listen, there's no need to take people like this seriously at all this is final."
C064101,Roman Telugu,Offensive,"Ila chudu, Enduku antha negative-ga untav eppudu Idi final. #WomenSafety","see here, why are you always so negative this is final."
C064107,Telugu,Hate Speech,"ఒక్క మాట, వీళ్ళు మాట్లాడేది వినడం కూడా టైమ్ వేస్ట్ గుర్తు పెట్టుకో. 😤","one thing, even listening to what they say is a waste of time remember this."
C064108,Roman Telugu,Offensive,"By the way, Evadu adigadu nee opinion Anthe. smh","by the way, who asked for your opinion that's it."
C064110,Roman Telugu,Offensive,"Ila chudu, Neelanti vallu valle social media padaipoyindi Nijanga.","see here, people like you have ruined social media really."
C064113,Telugu,Hate Speech,"ఊరికే చెప్తున్నా, ఫెమినిస్టులు వల్లే సమాజం పాడైపోతుంది నమ్ము నన్ను. ??","just saying, feminists are ruining society trust me."
C064119,Roman Telugu,Hate Speech,"Ila chudu, Vallaki eppudu edo oka complaint untundi anthe Ok na? 😤","see here, they always have some complaint or the other, that's it ok?"
C064125,Telugu,Hate Speech,"నిజం చెప్పాలంటే, ఆడవాళ్ళు ఇంట్లో ఉండాలి, ఆన్‌లైన్‌కి రావద్దు 😢","honestly, women should stay home, not come online"
C064127,Roman Telugu,Hate Speech,"Ila chudu, Adavalla maatalu eppudu nammakudadu asalu Anthe. 😤","see here, you should never trust what women say that's it."
C064133,Roman Telugu,Hate Speech,"Hey, Adavallaki sontha opinion undadu, evaro cheppindi vaadataru Nijanga. 😔","hey, women don't have their own opinions, they just repeat what someone told them really."
C064134,Roman Telugu,Offensive,Inta chettha video eppudu chudaledu Anthe.,never seen such a trash video that's it.
C064135,Telugu,Offensive,"ఊరికే చెప్తున్నా, వేస్ట్ ఫెలో, ఎందుకు ఇలాంటి పోస్ట్ పెడతావు అర్థమైందా?","just saying, waste fellow, why do you post nonsense like this got it?"
C064136,Roman Telugu,Hate Speech,"Vinu, Vallu andaru okate group-lo untaru, nammadaniki ledu","listen, they're all part of the same group, can't be trusted"
C064137,Roman Telugu,Hate Speech,"Chudu, Adavallaki sontha opinion undadu, evaro cheppindi vaadataru 🔥","look, women don't have their own opinions, they just repeat what someone told them"
C064141,Telugu,Offensive,"చూడు, ఇది చూసి నవ్వాలో ఏడవాలో అర్థం కావట్లేదు ఇది ఫైనల్. smh","look, don't know whether to laugh or cry seeing this this is final."
C064142,Roman Telugu,Offensive,"Okka maata, Neelanti vallu valle social media padaipoyindi Nammu nannu. ...","one thing, people like you have ruined social media trust me."
C064143,Telugu,Hate Speech,"విను, ఇలాంటి ఆడవాళ్ళ వల్లే మగవాళ్ళు బాధపడేది ఇది నిజం.","listen, it's because of women like these that men suffer this is true."
C064155,Roman Telugu,Offensive,"Ila chudu, Ilanti postulu petteముందు common sense vaadu Ok na? 😔","see here, use some common sense before posting things like this ok?"
C064157,Roman Telugu,Hate Speech,"Chudu, Adavallaki net access ivvadame pedda tappu Ok na?","look, giving women internet access itself was a big mistake ok?"
C064165,Roman Telugu,Offensive,"Nijam cheppalante, Neelanti vallu valle social media padaipoyindi Gurthu pettuko. !!!","honestly, people like you have ruined social media remember this."
C064173,Telugu,Hate Speech,"నిజం చెప్పాలంటే, ఈ జనరేషన్ ఆడవాళ్ళు రెస్పెక్ట్ ఇవ్వడానికి అసలు అర్హులు కాదు","honestly, this generation of women don't even deserve respect"
C064174,Roman Telugu,Hate Speech,"Nijam cheppalante, Adavallaki net access ivvadame pedda tappu Anthe. 😢","honestly, giving women internet access itself was a big mistake that's it."
C064175,Roman Telugu,Offensive,"Nijam cheppalante, Neeku burra ledha ila maatladatavu Arthamaindha? 😤","honestly, have you lost your mind, talking like this got it?"
C064178,Telugu,Hate Speech,"ఊరికే చెప్తున్నా, ఈ జనరేషన్ ఆడవాళ్ళు రెస్పెక్ట్ ఇవ్వడానికి అసలు అర్హులు కాదు ఇది నిజం. 😔","just saying, this generation of women don't even deserve respect this is true."
C064190,Telugu,Offensive,"నిజం చెప్పాలంటే, ఎందుకు అంత నెగెటివ్‌గా ఉంటావ్ ఎప్పుడూ 😔","honestly, why are you always so negative"
C064192,Roman Telugu,Offensive,"Chudu, Dini kante better content ekkadaina dorukutundi Seriously-ga. 😔","look, you can find better content anywhere than this seriously."
C064198,Telugu,Hate Speech,"ఒక్క మాట, వీళ్ళు అందరూ ఒకటే గ్రూప్‌లో ఉంటారు, నమ్మడానికి లేదు ఇది నిజం. ??","one thing, they're all part of the same group, can't be trusted this is true."
C064199,Roman Telugu,Offensive,"Vinu, Enduku antha negative-ga untav eppudu Idi nijam. 😔","listen, why are you always so negative this is true."
C064202,Telugu,Hate Speech,"బై ద వే, వీళ్ళందరూ ఒక్కటే, అటెన్షన్ కోసమే ఇదంతా చేస్తారు నమ్ము నన్ను. 🙄","by the way, they're all the same, doing all this just for attention trust me."
C064203,Telugu,Hate Speech,వీళ్ళకి ఎప్పుడూ ఏదో ఒక కంప్లైంట్ ఉంటుంది అంతే ఇది ఫైనల్. ...,"they always have some complaint or the other, that's it this is final."
C064204,Roman Telugu,Offensive,"Chudu, Ilanti postulu petteముందు common sense vaadu 😔","look, use some common sense before posting things like this"
C064208,Roman Telugu,Hate Speech,"Ila chudu, Vellandaru okkate, attention kosame idantha chestaru Gurthu pettuko. 😔","see here, they're all the same, doing all this just for attention remember this."
C064214,Roman Telugu,Offensive,"Chudu, Nuvvu maatladeముందు kaastha aalochinchu Seriously-ga. 😡","look, think a little before you speak seriously."
C064221,Roman Telugu,Hate Speech,"Chudu, Vallu andaru okate group-lo untaru, nammadaniki ledu Nammu nannu. !!!","look, they're all part of the same group, can't be trusted trust me."
C064223,Roman Telugu,Offensive,"Chudu, Neelanti vallaki attention ivvakudadu asalu Anthe. 🔥","look, people like you shouldn't be given any attention at all that's it."
C064224,Roman Telugu,Hate Speech,"Hey, Vellandaru okkate, attention kosame idantha chestaru Seriously-ga.","hey, they're all the same, doing all this just for attention seriously."
C064228,Roman Telugu,Offensive,"Okka maata, Inta chettha video eppudu chudaledu !!!","one thing, never seen such a trash video"
C064230,Telugu,Hate Speech,"ఇలా చూడు, ఫెమినిస్టులు వల్లే సమాజం పాడైపోతుంది అర్థమైందా? ...","see here, feminists are ruining society got it?"
C064235,Roman Telugu,Hate Speech,"By the way, Vallu maatladedi vinadam kuda time waste Gurthu pettuko.","by the way, even listening to what they say is a waste of time remember this."
C064246,Roman Telugu,Offensive,"Nijam cheppalante, Dini kante better content ekkadaina dorukutundi Seriously-ga. #WomenSafety","honestly, you can find better content anywhere than this seriously."
C064249,Roman Telugu,Hate Speech,"Mava, Ilanti vallani seriously-ga theesukovalsina avasarame ledu Idi final. 😔","bro, there's no need to take people like this seriously at all this is final."
C064253,Roman Telugu,Hate Speech,"Chudu, Ee generation adavallu respect ivvadaniki asalu arhulu kaadu Anthe. 😔","look, this generation of women don't even deserve respect that's it."
C064254,Telugu,Offensive,"ఒక్క మాట, వేస్ట్ ఫెలో, ఎందుకు ఇలాంటి పోస్ట్ పెడతావు అంతే. ??","one thing, waste fellow, why do you post nonsense like this that's it."
C064273,Roman Telugu,Offensive,Em buddhi lekunda maatladatav nuvvu Gurthu pettuko.,you talk with absolutely no sense remember this.
C064274,Roman Telugu,Hate Speech,"Urike cheptunna, Adavallaki net access ivvadame pedda tappu Idi nijam.","just saying, giving women internet access itself was a big mistake this is true."
C064283,Telugu,Offensive,నీ లెవెల్ చూస్తే జాలిగా ఉంది ఇది నిజం. 😔,seeing your level is honestly pitiful this is true.
C064291,Roman Telugu,Hate Speech,"Chudu, Adavallu intlo undali, online-ki ravaddu","look, women should stay home, not come online"
C064292,Telugu,Offensive,"బై ద వే, నీ కామెంట్లు చదివితే తలనొప్పి వస్తుంది సీరియస్‌గా. 😤","by the way, reading your comments gives me a headache seriously."
C064295,Roman Telugu,Offensive,"Chudu, Ilanti vallani chuste jaali kuda veyadu Ok na? 🙄","look, seeing people like this doesn't even evoke pity ok?"
C064296,Telugu,Hate Speech,"ఊరికే చెప్తున్నా, ఇలాంటి వాళ్ళని సీరియస్‌గా తీసుకోవాల్సిన అవసరమే లేదు నిజంగా. 😔","just saying, there's no need to take people like this seriously at all really."
C064300,Telugu,Offensive,"మావా, నువ్వు మాట్లాడేముందు కాస్త ఆలోచించు ఓకే నా? 😡","bro, think a little before you speak ok?"
C064302,Roman Telugu,Offensive,"Mava, Nee comments chadivithe thalanoppi vastundi Nijanga.","bro, reading your comments gives me a headache really."
C064310,Telugu,Offensive,"నిజం చెప్పాలంటే, దీని కంటే బెటర్ కంటెంట్ ఎక్కడైనా దొరుకుతుంది గుర్తు పెట్టుకో. smh","honestly, you can find better content anywhere than this remember this."
C064317,Telugu,Offensive,"చూడు, నీకు బుర్ర లేదా ఇలా మాట్లాడతావు ఇది ఫైనల్.","look, have you lost your mind, talking like this this is final."
C064319,Roman Telugu,Hate Speech,"Ila chudu, Ilanti adavalle asalu samasyalaki karanam Nijanga. 🙄","see here, women like these are the real cause of problems really."
C064320,Roman Telugu,Hate Speech,Ilanti vallani seriously-ga theesukovalsina avasarame ledu Idi nijam.,there's no need to take people like this seriously at all this is true.
C064322,Telugu,Hate Speech,"మావా, ఆడవాళ్ళు ఎప్పుడూ ఓవర్‌గా రియాక్ట్ అవుతారు ఓకే నా? ...","bro, women always overreact ok?"
C064338,Roman Telugu,Hate Speech,"Ila chudu, Adavallu intlo undali, online-ki ravaddu Ok na? 😡","see here, women should stay home, not come online ok?"
C064340,Roman Telugu,Hate Speech,"By the way, Vellandaru okkate, attention kosame idantha chestaru Arthamaindha?","by the way, they're all the same, doing all this just for attention got it?"
