comment_id,language,category,comment,english_translation
C049140,Telugu,Hate Speech,KCR డైరెక్ట్ గా ప్రణబ్ ముఖర్జీ కాళ్లు మొక్కీ నప్పుడు ఏమైoది,
C049146,Tanglish,Offensive,Ayyo..alluthu.... Naan chinna vayasula epdi yosuchano adha apdiye patha maari irukku,
C049150,Tanglish,Offensive,Bigiil mokka padam .. kaithii awesome,
C049151,Tamil,Hate Speech,அடங்க மறு கும்பலை அறுக்க வருகிறாள் திரௌபதி.....,
C049165,Roman Telugu,Hate Speech,ori shankari neku party salary istundi kani maaku jobs istaledu raa,
C049174,Roman Telugu,Hate Speech,amarica andatho madam perigi kotukuntundi urikine,
C049176,Roman Telugu,Hate Speech,Mahanu baava ela kannavayya ee Basmasurani,
C049178,Telugu,Hate Speech,అబ్బ అబ్బ ఎం యాక్టింగ్ సూపర్ సినిమా లో నటిస్తే ఆస్కార్ గ్యారంటీ,
C049180,Tanglish,Offensive,It looks to me like the hindi movie Andhadhun..,
C049181,Tanglish,Offensive,Sema Mass ....POLI...... SURIYAVAUM ANTIINDIAN akitanga PA...,
C049183,Roman Telugu,Hate Speech,ilanti celebritylu ilah shosh kuu ravali sir,
C049184,Roman Telugu,Hate Speech,ee madhya meeredo ascar avaardu sinimaalu padutunnattu cheptunnarenti edho ataniki nacchi pattadu adhi janaalaku nachatledu marrow sinimaatho mundu vastaadu athani daggariki velli dhairyam cheppalsindi public loo tidatarenti saar,
C049190,Tanglish,Offensive,Podu thagida Petta Paraak Kola Gaandla irukan,
C049191,Telugu,Hate Speech,ఆంధ్రప్రదేశ్ ఇసుక మాఫియా డాన్ జగ్గు భాయ్.,
C049204,Kanglish,Hate Speech,Mangala grahake hogovrige a ashwathama eddhidhre antha gotthidhre avnanne kurskondu mahabharatha kathene poorthi aagi barskotha edhru aste yake mahabharatha nadedhitthanthe anno badhalu mahabaratha naddhidhu sathyane antha proof kuda madtha edhralwa,
C049205,Kanglish,Hate Speech,Kabja kannada samrajya nucchu noor madtade,
C049207,Tanglish,Hate Speech,Therke Devendrar vadake vanniyan iru samugathukum mannum ponnum onnu..yevan kai vachalum vettuthaan..,
C049208,Kannada,Hate Speech,ಚಳಿಗಾಲದಲ್ಲಿ ಹೆಂಡ್ತೀನ ಬಿಟ್ಟಂಗಾಗಿದೆ Tik tokers ಸ್ಥಿತಿ Like a ಹೀಟ್ ಗೆ ಬಂದಿರೋ ನಾಯಿ ತರ,
C049209,Tanglish,Offensive,manaketa anil pundainga en da dislike pannaringa un kjuy padam varuthula sethinga daw,
C049210,Tanglish,Offensive,Saho trailer 20 hrs le took more views. Nerkonda paarvai nakkitu poirchu.,
C049211,Tamil,Hate Speech,இது சராசரி படம் அல்ல. ஒற்றைச் சாதியை மட்டுமே அப்பாவிகளாக உயர்த்திக் காட்டி பிற சாதிகளை இழிவுபடுத்திய நாய்களுக்கு () இது ஒரு பாடமாக இருக்கும். அந்த நாய்கள் என்னென்ன திருட்டுத்தனங்களைச் செய்கின்றன என்ற உண்மையைக் காட்சிப்படுத்திய அண்ணன் மோகனுக்கு நெஞ்சார்ந்த நன்றிகள். இந்த படத்திற்கு அமோக வரவேற்பை வழங்கி வெற்றிபெற வைப்பது நம் கடமை . திரௌபதி தீயவர்களைத் தீயாய் சுடுவாள்.,
C049212,Tanglish,Offensive,"thalaivaaaaaaaa thalaivaaaaaaaa... thalaivaaaaaaaa.. thalaivaaaaaaaa... Super surya anna... who r keeping negative comments vijay nd ajith fans suck ur vijay, ajith dick... jai super star thalaiva surya anna from andhra fans... I can't control my tears .... surya Anna we love... jai thalaiva frm andhra fans",
C049214,Tanglish,Hate Speech,vedhalam teaser ah compare panrapa idhu elam pakame vara mudiyadhu...worst bhairava teaser,
C049215,Roman Telugu,Hate Speech,telugu rashtraalaki manchi manchi nayakulu dorikaaru sinimaalu vellanavasaram ledhu valle cinema chuupistaaru manchi kaalakshepam,
C049216,Roman Telugu,Hate Speech,Bro vaadi height entha bro.... sampu kante comedy ga vunadu ...,
C049218,Roman Telugu,Hate Speech,e 75kurma bharataswatantra desaniki nizamaina geept ichchavu anna nuvvu desamloni prathivaadu garvapadela vundi,
C049230,Tanglish,Offensive,Yellam ok Ore oru korai Trailer komjam munnadiye poturkalam,
C049233,Kannada,Offensive,Parthasarathi ಅಂತೂ ಒಪಿಕೊಂಡಲ್ಲ ದೊಡ್ಡ ಷಂಡ ಅಂತಾ,
C049234,Tanglish,Offensive,Kaithi verithanamlast dialogue ...saavuratha erunthalum sanda poittu saganum sir..bayanthu kala vilunthu saga kudathu,
C049236,Roman Telugu,Hate Speech,too bay frankly host kante chee chaala humble gaa react ayyaru real love hiss nature,
C049238,Roman Telugu,Hate Speech,one and onlee mega star potthi leruraleru,
C049239,Kannada,Hate Speech,ಸೂಪರ್ ಗುರು ಉಗಿರಿ ಟಿಕ್ ಟ್ಯಾಕ್ ಗೆ,
C049246,Kanglish,Offensive,Stupid Fans neenu Darshan ge huttirbeku adike avn bagge ne mathadthidiya nimman thulna keyya soole magane.nim amman thull ge kathe thunne sigaka hogi bale akolo aaa gaandu lucha thara,
C049255,Roman Telugu,Hate Speech,Super darling Nuvvu vachaka janamlo ooopu vachindhi,
C049257,Roman Telugu,Hate Speech,Waste fellow he did nothing for telengana,
C049261,Roman Telugu,Hate Speech,Nenu e stage raavadaniki Karanam e stage vesinollaa,
C049263,Tanglish,Offensive,indha bgm ah mattum ena pundaikku copy adichan indha ilayaraja 🤣.. oru vela aanama poirucho,
C049270,Roman Telugu,Hate Speech,Mundu.vacchinollu.peekipoyaru.eeyanocchi.peekuthadu,
C049273,Roman Telugu,Hate Speech,super bangaaram amma,
C049280,Roman Telugu,Hate Speech,ii veediyo chusina tarvaata ilanti manchi manushulu untara ani chaalaa santosham anipinchindi,
C049284,Kanglish,Offensive,Stupid Fans ley gaandu soole magane modlu ninnathra adu idiya antha nodkolo hodiyoke bandu hodsokondanthu hogthiya,
C049286,Telugu,Hate Speech,నువ్వు నిజమైన హీరోవి పవర్ స్టార్ లు మెగా స్టార్ లు తెరమీద మాత్రమే హీరోలు నిజజీవితంలో వాళ్ళు జీరోలు,
C049288,Tanglish,Offensive,Verithanam savuratha irundha sanda potu savanum ithaaaaa Kola mass,
C049295,Tanglish,Offensive,"Ithu 96 u, Yaara Yemathringa!!!!!!!!!1 Ultiiiiiiii",
C049300,Tamil,Offensive,திருமா என்ற குறுமக்கு சூப்பர் செருப்படி 🦍,
C049303,Tamil,Hate Speech,மகிழ்ச்சி. . வாழ்த்துக்கள் படம் மிகப் பெரிய அளவில் வெற்றி பெறும். கடைசி வசனம் அருமை. இன்னும் 16 வருடம் போனாலும் நான் அரசியலுக்கு வருவேன் தான் சொல்லுவான். ஆனால் இப்போது எல்லாம் வர மாட்டார். வரவும் வேண்டாம்.,
C049304,Telugu,Hate Speech,సాక్షి ఎప్పుడు కరెక్ట్ రాసింది అది ఎప్పుడు తప్పే రాస్తుంది,
C049309,Roman Telugu,Hate Speech,argievy tho vaaka interview plan chestunava nuvu kuudaa,
C049310,Tamil,Offensive,எல்லாம் ok but தளபதி விஜய் சீன்ல சிரிச்சது எனக்கு புடிக்கல,
C049314,Tanglish,Offensive,Yov vera level la yeduthurkingayaThat kizhinji pona jeans,
C049315,Tanglish,Offensive,Thala haters lam orama poi kathurunga da pundaikala,
C049320,Roman Telugu,Hate Speech,neenu chusina vaelaadi funny veediyolallane top 1 lady action veediyo idhi ammai action super,
C049323,Kanglish,Hate Speech,Don't Post FAKE videos,
C049331,Tanglish,Offensive,mokka bhairava teaser ela but naa suriya fan taan,
C049342,Roman Telugu,Hate Speech,meeru famous aipoyaru akka,
C049345,Roman Telugu,Hate Speech,"Andhuke dhula Baga thirindhi ,annaaaa",
C049346,Tanglish,Offensive,"Thala fans , views ean slow ah irukudhu ? Orivelai counting agama irukka ? Enna kaaranam ?",
C049350,Tanglish,Offensive,Petta parak rajinians mattum ulla iru mathavanlam odi poidu vantha thangamatta,
C049351,Tamil,Hate Speech,Vani fans like panunga Rithika fans like panunga இந்த கம்மெண்ட போட்டே பிச்சை எடுக்குறானுங்க,
C049353,Roman Telugu,Hate Speech,tara bhai joginder oka chinal chutiye manishi paniki malina vadu,
C049357,Tanglish,Offensive,Enda nala name ipdi veenaku reemga kadaramkondan enapathu evlo Periya maveeranoda name fuck,
C049358,Telugu,Hate Speech,వరిని యాచించని జీవితం ఆయాసం లేని మరణం మరణం తరువాత నీలో ఐక్యం కావాలి అని అష్ట దిగ్గజాలు లో ఒకరు ఐన ధూర్జటి కవి చెప్పారు అదృష్ట వంతుడు,
C049359,Kanglish,Offensive,Prithvi swalpa otte kadme maadkoli ...you look good as well you need it as an actor...,
C049362,Kanglish,Offensive,Kharabbu Pogaru song Like - 317K,
C049364,Roman Telugu,Hate Speech,Ellati guruvu kanni boka lo aiyali,
C049382,Telugu,Hate Speech,డబుల్ మీనింగ్ లేకుండా దమ్ముంటే కామెడీ చేసి చూపించండి రా,
C049386,Tanglish,Hate Speech,"Mannuku dha manushan mela eppayume urimai undu ellam poradhu anga dha poganum,adhu vara evlo aada mudiyumo aadunga da,nilam engal urimainu loosu maari pesinu ida othikidu vaanguringa,reserved seats la poringa naanga daily adipattu midhi pattu suthikitu irrukanum,unga ista pundaiku padam edukradhu kaala,kabali,mairunu meedhi irrukura general category veral soopuradha,padathula enna solla varanunganu theriyama loosu comment box la olaradhinga",
C049387,Roman Telugu,Hate Speech,middle order marchu vinnale world cuo degindhi asia cuo dengindhi poyi gully circket adukondi,
C049388,Roman Telugu,Hate Speech,harsha saayi fance entamandi unnaruikkada aaa maan with golden heart,
C049389,Tanglish,Hate Speech,"kunjith, kuruma, dmk moonjula kaarithupuna moment....jaathi vechi arasiyal panum ,adhuvum mukyama sc ku supprt panranu paerla nadathra nadagama pottu odachitaaru director🤣🤣🤣",
C049394,Kanglish,Hate Speech,Re e video post agiddu yavaga apps ban agirodu yavaga adu moldu nodir sumne yeneno mathadbedi,
C049399,Kannada,Offensive,Parthasarathi ನಂದಿನಿ ನಿನ್ ಮಲೆ ಹೀಚುಗ,
C049404,Roman Telugu,Hate Speech,ninu chustunte kgf cinemalo rockie boy gurthuku vastunnadu,
C049406,Tanglish,Offensive,1:10 Note : Engineering padicha velai ila,
C049412,Roman Telugu,Hate Speech,Yerripooka,
C049417,Tamil,Offensive,"அடேய் அப்பிரசண்டிகளா . இளையராஜா பீத்தோவனோட fur elise அ காப்பி பண்ணிட்டார்னு உளறாதீங்கடா. Descriptionல தெளிவா போட்ருக்கே டிரைலர் மியூசிக் மிஷ்கின் னு.fur elise ரொம்ப பாப்புலர் ஆன டியூன்.அத நிறைய கார்ட்டூன்,டிவி ஷோ,படங்கள் ல பயன்படுத்துவாங்க.அதே மாதிரி மிஷ்கின் அந்த டியூன இந்த டிரைலர்க்கு பயன்படுத்திகிட்டார்.அவ்ளோ தான்.உடனே இளையராஜா காப்பிகேட்னு ஒரு கூட்டம் கிளம்புது.ஏன்டா காப்பி அடிச்சாலும் இவ்ளோ famous ஆன டியூன் அ வாடா காப்பி அடிப்பாங்க🤦‍🤦‍",
C049419,Tamil,Hate Speech,"முத்தையா : மண்ணை தொட்டவன் கூட விட்ரலாம், ஆனா நம்ம v2 பொண்ண தொட்டவன விட கூடாது..... மோகன் ஜீ : எங்களுக்கு மண்ணும், பொண்ணும் ஒன்னு தான், அதுல எவன் கை வச்சாலும் வெட்டுவோம்..... நம்ம வீட்டு பொண்ணுங்க பாதுகாப்பு பத்தி பேசுற படம்..... இதுல கூட ஜாதி தெரிஞ்ச, நீ தான் லூசு கூ",
C049421,Tamil,Hate Speech,அறிவீழியகளா ஜாதியை ஒழிக்கிறேன்ற பேர்ல படம் எடுத்து இன்னும் ஜாதி வெறிய தூண்டதான் செய்றிங்க உங்க அரசியல் இன்னும் பலருக்கு தெரியல,
C049430,Kanglish,Offensive,BOY yappa Modlu Arta ago Tara type maadu,
C049433,Tanglish,Offensive,Ae ithu 96' uu yara emathuringa...,
C049437,Tanglish,Offensive,Ketta paiyan sir indha Kaali. “I’m a bad boy.”,
C049439,Tanglish,Offensive,Poittu vedlam Movie Like podungada Inga BAIRAVA Movie Ku Unlike poduringala Ungaluku Vekkama illla ithu VIJAY kottài,
C049445,Tanglish,Offensive,Kola gaandu la irukaen padam paaka,
C049448,Kanglish,Offensive,Bindhu sulee tiktok sadee roast Madhu ivaladhuuu full roast madeeee jai indian army,
C049451,Tamil,Offensive,ஓநாய் பாததெல்லாம் திங்காது டா அதுவும் பெண் சிங்கம் மட்டும் தான் வேட்னடயாடும் அப்ப நீ என்ன பொட்டயா எந்த காலத்துல வந்து என்ன மாதிரி னடலாக் எழுதுராங்க பாரு தூதேரி,
C049453,Roman Telugu,Hate Speech,Good mama tisukeli railway station lo padeyandi,
C049462,Kannada,Offensive,Parthasarathi ನಂದಿನಿ ನಂದಿನಿ ನಿನ್ ತುಲ್ ಊರ್ ಬಾಗ್ಲು,
C049485,Tanglish,Offensive,Yethaiyum copy pannala but romba mepokka erukku,
C049486,Tanglish,Hate Speech,mokka trailer semma joke name bhairava oh! hi chellam bhairavi,
C049492,Roman Telugu,Hate Speech,"Jagan ni poguthunnava, leka mingutunnava...indirect ga jagan secret lu ani cheptunnav.",
C049494,Tamil,Hate Speech,"சில தரித்திரங்கள் சொல்லியது. 1. அவன் ஆட்களிடம் சரக்கு மிடுக்கு இருக்கிறதாம் அதனால் அவனின் பின்னால் பெண் பிள்ளைகள் செல்கின்றதாம். 2. நாம் ஆண்களே கிடையாதாம் அந்த நாய்கள் தான் ஆண்களாம். 3. நாம் எவ்வளவு செலவு செய்தாலும் நம் பின்னால் பெண்கள் வர மாட்டார்களாம், ஆனால் 5 ரூபாய்கு அயர்ன் பன்ன சட்ட போட்டுட்டு போனா போதும் அவனின் பின்னால் போய் விடுகிறார்களாம். 4. நம் பெண் பிள்ளைகள் பறப்பையன் எங்கு இருக்கிறான் என்று தேடித்தேடி அவனின் பின்னால் போகிறார்களாம். இதையெல்லாம் கேட்டதும் சொல்லியவனின் நாக்கை வெட்டத் தோன்றியது. ஆனால் அவனின் பின்னால் தானே சட்டங்களும் சனியன்களும் இருக்கின்றன.",
C049497,Kanglish,Offensive,Gangatkar guru ninge gotagalla sumne eru bale pans start madidare nau end madthivi e mathna thuldeepannan pansgu helu modlu,
C049501,Roman Telugu,Hate Speech,enni rojulu ayindi anna nae veediyo chuusi,
C049512,Roman Telugu,Hate Speech,appudu evadra veedu annavaallantaa ippudu claps kodutunnaru nuvvu super brow anantapuram hareesh,
C049517,Tamil,Offensive,டேய் என்னடா சுன்னி சார்பாக வாழ்த்துக்கள் சுன்னி சார்பாக வாழ்த்துக்கள் கமன்ட் பன்றிங்க ஜாதி வெறி பிடித்த நாய்களா நான் உங்களை செல்லி நாய் அசிங்கப்படுத்துரன் நீங்க அதுக்கும் கீழ,
C049523,Tamil,Hate Speech,"செருப்படி ரஜினிக்கு.. சூப்பர் kv ஆனந்த் இது தாண்ட சினிமா கேட்கமுடியாத கேள்விகளை சினிமாவில் கேட்களும் ஏன்னா அது ரீல், அதுபோலதான் சினிமாவின் ஹீரோக்கள் ரியல் ஹீரோ இல்லை ரீல் ஹீரோ ரஜினிக்கும் கமலுக்கும் புரிஞ்சா சரிதான்",
C049528,Telugu,Hate Speech,కృష్ణ గారు బ్రతకాలిమా చిన్నప్పటి నుండి చూస్తున్నాంఎన్నో సినిమాలు,
C049537,Roman Telugu,Hate Speech,super anna nitin anne baya padela entry evharu,
C049540,Tanglish,Offensive,Rowdyngaluku support ilama iruntha nala irukkum,
C049542,Roman Telugu,Hate Speech,"Official ga 600 acres ante, unofficial GA enno, okko family member peru meedha enni ekaraalu unnayo.. Raitu bandhu okkati chalu,",
C049548,Tanglish,Offensive,Naa trailer ah thalaivar kaga pakka varala..vj sethu anna kaga than pakka vandhurukken..🤩,
C049550,Tanglish,Offensive,Ada pavingala intha teaser aa Kabali teaser break panna poguthu ha ha...,
C049555,Roman Telugu,Hate Speech,acting super undhi gaa brow just story loo dammu ledh,
C049557,Tanglish,Offensive,Loosu payalugala 96 la epo da Thalaivar politics ku varen nnu sonnaru...? ku muttaigala,
C049560,Tamil,Offensive,சுயமாக சிந்திக்க தெரிஞ்சவன் தான் சூப்பர் ஹீரோ' - 100% true in the age information abundance and mass distractions.,
C049570,Tanglish,Hate Speech,Dai Idhu 90's Kids Yaara Yemaathureenga I m also 90's Kids,
C049571,Roman Telugu,Hate Speech,Andhra police meedha eppudo nammakam poyindhi,
C049574,Telugu,Hate Speech,బాగా చదివినవ్ గా రాసుకుని మరీ.. మధ్యలో మన భార్యలు అన్నావ్ చూడు,
C049575,Tanglish,Offensive,Rajini ah kalaikaratha film la irunthu thookama irukanum semaiya iruku rajini ah otanathu anbumani ramadoss said enaku kalyanam agara apo irunthu sonaru arasiyaluku varuvenu ipa en ponnuku kalyanam airuchu inum athaiye solitu irukarunu,
C049577,Tanglish,Hate Speech,neengale naxal madtri pesringa... badhilaa... neengale URBAN NAXAL maadri pesuringa... semma yaa irukkum.. hit if u like,
C049580,Tamil,Hate Speech,பெயருக்கு பின்னாடி சாதிய சேர்க்கிறது சாதி வெறினா??? சாதி பெயரை சொல்லி சலுகை வாங்குறத... கொல்லைப்புறமா கூட்டிக்கொடுக்கிறதுன்னு சொல்லலாம்தானே!!🤔,
C049581,Roman Telugu,Hate Speech,sravanti akka dont cry bay strong vii r 4u,
C049585,Tanglish,Offensive,Na Tralier pakave Ila ahnalum Nalave ila🤣🤣🤣,
C049591,Tanglish,Offensive,Aadhi anna na unnoda periya fan mersal scene vachu sirikkirathu pudikala,
C049593,Telugu,Hate Speech,రామోజీ రావు ని వీడి కనా వేస్ట్ గాడు అన్నావు ఆయన్ని కలవటానికి నీవు చెప్పిన అమిత్ షానే అయన ఇంటికి వెళ్లి కలిసాడు సోంబేరి వదవా నీకు ఎమితెలుసు రా .,
C049600,Roman Telugu,Hate Speech,maccha anna loo oka singer unnaadubayataku rappinchandi bayyamacha anna oka famous singer avutaaru,
C049602,Tanglish,Offensive,Rajini arasiyal ke vanthutara ileya ? 🤔,
C049608,Kannada,Offensive,ಏನ್ ಹೇಳೋಣ.....?nSimply ಸೂಪರ್.......nದಿಯಾ ಮಾತ್ರ ಅಲ್ಲ... ಇಂಥಹ ಹಲವು ಸಿನಿಮಾಗಳು ಗೆಲ್ಲುತ್ತಾ ಇಲ್ಲ...ನನ್ನ ಪ್ರಕಾರ ಥಿಯೇಟರ್ ನ ಟಿಕೆಟ್ ಬೆಲೆ ಕಡಿಮೆ ಅಗಬೇಕು.,
C049610,Tamil,Offensive,பீத்தோவன் musicக அப்படியே use பண்ணி இருக்குறானுவ....வெக்கம் கெட்ட rascals. சொந்தமா music போடுங்கடா. Copy அடிக்கிற ஒவ்வொருதவனும் ஆம்பள இல்லன்னு இந்த நார வாய் தானே சொன்னுச்சி....,
C049612,Tamil,Offensive,டேய் நாயே . எங்களுக்குள்ளே அடிச்சிக்கிட்டளும் நாங்க ஒன்னு செர்ந்துக்குவோம். யேன நாங்க பங்களிங்க டா இப்போ அடிச்சிக்குவோம் அப்பறம் பிரச்சன நீ வந்தா ஒன்னு சேர்ந்துடுவோம் டி . கொஞ்சம் தள்ளி ய இருந்துக்கு அதன் உங்களுக்கு நல்லது,
C049614,Kanglish,Offensive,Thanks ellakade link Sher madi nTukali kushmikage hattiro kobbanna elisi,
C049616,Telugu,Hate Speech,మోహన్ బాబు గారు కొన్ని ప్రశ్నలకు సమాధానం చెప్పలేక బిక్కమొహం వేశాడు. నీళ్లు నములుతున్నాడు,
C049621,Tanglish,Offensive,Intha mama marumagan tholla thaanga mudila,
C049629,Tanglish,Offensive,Mass hero va aaga 1 percent kooda laakki illaatha Oru moonji,
C049634,Tanglish,Offensive,dei view yanna da half an hour ra apadi irukku,
C049640,Roman Telugu,Hate Speech,telamgaana dongalu evaru diniki kuudaa samaadaanam cheppandi,
C049642,Tamil,Offensive,"என்ன இழவுடா இது? கங்கனாக்கு தமிழே தெரியாது, அவங்களை வைத்து ஜெயலலிதா அவர்களின் வாழ்க்கை கதை எடுக்க உங்களுக்கு எப்படி மனம் வந்தது விஜய் அவர்களே?",
C049649,Roman Telugu,Hate Speech,thu bandhu lu andaru raitulaku echinattu andaru dalitulaku dalita bandhu estaarameeru m ina mea own amount estunnara maa amt make estunnara,
C049652,Tanglish,Offensive,Family yoda padam parka mudiyathu pola.....,
C049656,Tanglish,Hate Speech,loose pasangala heroin set ye agala da ava paithiya kari mari reaction kudukara kelvalama iruku as like animated movie...don't you have Brain to think,
C049661,Telugu,Hate Speech,జైభీమ్ ముస్లింలకు మద్దతీవ్వడమంటే అంబేద్కర్ గారిని అంబేద్కర్ గారు వ్రాసిన రాజ్యాంగన్ని అవమానిచ్చినట్టే,
C049668,Tanglish,Offensive,mammokka hero da always will be a hero,
C049670,Tanglish,Offensive,"My dear 47k dislikers RIP, verithanam varatum anga papom.",
C049672,Tanglish,Offensive,komali rasini vesam pottu tamil ilichavayangala ematharan,
C049688,Tanglish,Offensive,Yandha court laiyum ipudi nai mathirre kathaara mattanga bha 🤣🤣 Rip nerkonda parvai,
C049696,Roman Telugu,Hate Speech,prati tandri korukunedi idejagamerigina satyammeeru sadhincharu adrushta vantulu meeru,
C049698,Telugu,Hate Speech,ముందు సరిగా మాట్లాడటం నేర్చుకో ముందు నువ్వు గెలుపు గెలవక పోతే నీ పరిస్థితి ఏంటో?,
C049711,Roman Telugu,Hate Speech,raja shekhar reddemy prajaakshemam corey goppa manasunna manishi kaadu aayana “maha meetha” ayithe aayana koduku jagan tandrini minchina “maha maha meetha”,
C049713,Tamil,Hate Speech,"ஒரு உரலு, 5 ஓலக்கை,, 5:1, gang bang theory. very very long ago. திரௌபதி வெற்றியடைய வாழ்த்துகள்.,",
C049714,Kanglish,Offensive,Ondu varshakke 1or2 film madodkintha entha ondu olle film madidre kannada industry ellige ogutthe,
