comment_id,verdict,corrected_category,reason
C010021,Wrong,Safe,"Negative opinion about dance/movie quality, not hateful"
C010022,Wrong,Safe,"Regional pride statement, not hateful"
C010023,Wrong,Safe,"Well-wishes, not hateful"
C010026,Wrong,Safe,"Sarcastic comment about political ambition, not hateful"
C010029,Wrong,Offensive,"Mild insult about actor's political ambitions"
C010030,Correct,,"Vulgar insult directed at dislikers"
C010032,Wrong,Safe,"Compliment, not hateful"
C010039,Wrong,Offensive,"Critical/mocking comment about actress's appearance and dress, personal not group hate"
C010042,Wrong,Safe,"Criticizes objectification of women, not itself offensive"
C010044,Wrong,Safe,"Sarcastic political comment, not hateful"
C010047,Wrong,Safe,"Critical opinion about mocking scene, not vulgar"
C010051,Wrong,Safe,"Neutral comment about duplicate/copy, not offensive"
C010052,Wrong,Safe,"Mocking comment about trending algorithm, not vulgar"
C010058,Wrong,Safe,"Neutral fan comparison, not offensive"
C010068,Wrong,Safe,"Neutral question about movie competition, not hateful"
C010073,Wrong,Safe,"Critical social commentary suggesting underrepresented topic"
C010078,Wrong,Safe,"Critical fan opinion about actor's role choices, not offensive"
C010082,Wrong,Safe,"Dismissive fan-war comment, not offensive"
C010083,Wrong,Safe,"Movie tagline referencing historical caste figure, not real threat"
C010085,Wrong,Safe,"Political criticism about farmer bandh and journalism bias"
C010086,Wrong,Offensive,"Judgmental comment about a woman's priorities/makeup focus"
C010094,Wrong,Safe,"Sarcastic comment about actor's regional preference, not offensive"
C010099,Wrong,Safe,"Mocking comment about roasting skills, not vulgar"
C010107,Correct,,"Derogatory slur directed at actor"
C010114,Wrong,Safe,"Critical comment about casting choice for children's film rating"
C010115,Wrong,Safe,"Critical opinion about movie stories/influence, not hateful"
C010120,Wrong,Safe,"Well-wishes for actress, not hateful"
C010124,Correct,,"Caste/religion framing combined with vulgar mocking of caste group and director"
C010127,Wrong,Safe,"Neutral political request, not hateful"
C010133,Correct,,"Vulgar insult directed at individual"
C010135,Wrong,Safe,"Negative opinion about BGM, not hateful"
C010137,Wrong,Safe,"Neutral observation about comment copying, not offensive"
C010138,Correct,,"Vulgar sexualized mocking directed at named individual/channel"
C010139,Wrong,Safe,"Neutral fan comment, not offensive"
C010140,Wrong,Safe,"Neutral stats compliment, not offensive"
C010141,Wrong,Safe,"Nationalistic commentary against China, not hate speech"
C010143,Wrong,Safe,"Compliment, not hateful"
C010144,Wrong,Safe,"Movie tagline hype comment, not real threat"
C010146,Wrong,Safe,"Political criticism about fuel prices, not hateful"
C010148,Unsure,,"Garbled mocking comment referencing medical condition, unclear"
C010158,Wrong,Safe,"Compliment, not hateful"
C010160,Wrong,Safe,"Neutral comment, not offensive"
C010163,Wrong,Safe,"Compliment, not hateful"
C010167,Correct,,"Vulgar insult at named individual"
C010170,Wrong,Safe,"Neutral comparison, not offensive"
C010171,Wrong,Safe,"Defensive political comment, not hateful"
C010172,Wrong,Offensive,"Mocking rival fanbase nickname, fan-war banter"
C010184,Wrong,Safe,"Neutral comparison suggestion, not hateful"
C010187,Correct,,"Vulgar insult directed at actor"
C010188,Wrong,Safe,"Neutral comment about nickname/role, not hateful"
C010189,Unsure,,"Vague comment, unclear meaning"
C010193,Wrong,Safe,"Neutral social commentary, not offensive"
C010202,Correct,,"Vulgar insult directed at group"
C010212,Wrong,Safe,"Well-wishes for actress, not hateful"
C010213,Wrong,Offensive,"Vulgar mocking comparison to sexual content, not hate speech"
C010215,Wrong,Safe,"Mocking critical comment about movie plot, not vulgar"
C010221,Wrong,Safe,"Neutral movie reference comment, not offensive"
C010222,Wrong,Safe,"Sarcastic political comment, not vulgar"
C010230,Unsure,,"Garbled text, unclear meaning"
C010231,Wrong,Offensive,"Vulgar exclamation, personal not hate"
C010239,Wrong,Safe,"Challenging critical comment about VFX, not vulgar"
C010243,Wrong,Safe,"Neutral critical fan comment, not hateful"
C010244,Wrong,Offensive,"Mocking insult implying a woman is drunk, personal not hate"
C010245,Correct,,"Vulgar slur insult directed at commenters"
C010247,Correct,,"Vulgar insult directed at individual"
C010248,Wrong,Offensive,"Vulgar dehumanizing 'dog' insult at individual, not group hate"
C010251,Wrong,Threat,"Curses dislikers to vomit blood and die"
C010260,Wrong,Safe,"Critical opinion suggesting career change, not vulgar"
C010261,Wrong,Safe,"Neutral factual comment, not hateful"
C010262,Wrong,Offensive,"Harsh personal criticism of actor, not hate speech"
C010264,Wrong,Offensive,"Vulgar mocking comment about dislikers"
C010266,Wrong,Safe,"Neutral movie dialogue discussion, not hateful"
C010267,Wrong,Safe,"Political criticism defending politician, not hateful"
C010269,Correct,,"Extremely vulgar sexual insult chain"
C010276,Wrong,Offensive,"Derogatory term calling news channel useless, not hate speech"
C010278,Correct,,"Insult questioning masculinity"
C010282,Wrong,Safe,"Neutral comment, not hateful"
C010284,Wrong,Safe,"Critical opinion about movie hype, not vulgar"
C010286,Wrong,Safe,"Neutral fan comment about release date, not hateful"
C010295,Wrong,Safe,"Fan compliment, not hateful"
C010301,Wrong,Offensive,"Mocking insult implying actor ruins movies, personal not hate"
C010302,Unsure,,"Vague casual comment, unclear meaning"
C010306,Wrong,Safe,"Mocking criticism about cricket skills, not vulgar"
C010309,Wrong,Offensive,"Vulgar suggested alternate title for movie, not group hate"
C010310,Wrong,Safe,"Neutral comment about career, not hateful"
C010312,Wrong,Safe,"Political accusation about preventing meetings, not hateful"
C010313,Wrong,Offensive,"Vulgar insult, unclear exact target but not group hate"
C010316,Wrong,Safe,"Criticism of fan rivalry, not vulgar"
C010327,Wrong,Safe,"Neutral political request about reputation, not hateful"
C010328,Wrong,Safe,"Critical opinion about comedy style, not vulgar"
C010333,Wrong,Safe,"Political criticism about hypocrisy, not hateful"
C010338,Wrong,Hate Speech,"Caste-based stereotyping using 'Yadava' pejoratively"
C010339,Wrong,Safe,"Negative opinion about movie quality, not hateful"
C010342,Correct,,"Vulgar insult directed at group"
C010344,Correct,,"Vulgar insult at named individual"
C010347,Wrong,Safe,"Mocking criticism about movie quality, not vulgar"
C010348,Wrong,Sexual Harassment,"Explicit predatory sexual statement targeting girls"
C010352,Wrong,Safe,"Positive message about religious unity, not hateful"
C010355,Wrong,Safe,"Fan compliment, not offensive"
C010367,Wrong,Safe,"Political criticism about police inaction, not hateful"
C010368,Wrong,Safe,"Fan hype comment, not offensive"
C010370,Wrong,Safe,"Neutral comment about opportunity, not hateful"
C010371,Wrong,Safe,"Political campaign message, not hateful"
C010372,Wrong,Safe,"Neutral critical opinion, not offensive"
C010373,Wrong,Safe,"Fan hype comment, not offensive"
C010374,Wrong,Safe,"Compliment, not hateful"
C010377,Wrong,Offensive,"Callout criticizing inappropriate touching, not itself harassment"
C010379,Wrong,Offensive,"Anti-caste message but uses violent 'destroy the animals' rhetoric"
C010380,Wrong,Safe,"Political criticism about indiscriminate talk, not hateful"
C010386,Wrong,Safe,"Political mocking prediction, not hateful"
C010396,Correct,,"Vulgar personal insult, not group hate"
C010400,Wrong,Safe,"Neutral question, not offensive"
C010401,Wrong,Offensive,"Vulgar dehumanizing insult at filmmakers with caste reference"
C010402,Wrong,Offensive,"Mild dehumanizing insult at dislikers, fan hype not hate speech"
C010407,Wrong,Safe,"Criticism of fan rivalry, not vulgar"
C010413,Wrong,Offensive,"Vulgar personal insult at filmmaker combined with critical commentary"
C010417,Wrong,Safe,"Neutral stats comment, not offensive"
C010418,Wrong,Offensive,"Vulgar personal insult, not group hate"
C010420,Wrong,Safe,"Critical accusation of music theft, not vulgar"
C010423,Unsure,,"Garbled political comment, unclear meaning"
C010424,Wrong,Safe,"Political corruption accusation, not hateful"
C010431,Wrong,Safe,"Neutral stats comment, not hateful"
C010432,Correct,,"Derogatory distortion of anti-caste leader's name, blames Dalits, caste-pride framing"
C010433,Wrong,Safe,"Compliment, not hateful"
C010435,Wrong,Safe,"Neutral suggestion about casting, not offensive"
C010436,Correct,,"Vulgar insult directed at named individual"
C010440,Wrong,Safe,"Negative opinion about movie, not vulgar"
C010444,Wrong,Safe,"Neutral excited fan comment, not offensive"
C010447,Wrong,Offensive,"Mild insult about speaking skills, not hate speech"
C010450,Wrong,Safe,"Compliment, not hateful"
C010451,Wrong,Offensive,"Harsh curse wishing abandonment in desert, personal not hate"
C010453,Wrong,Safe,"Compliment, not hateful"
C010464,Wrong,Safe,"Neutral comment about action scenes, not hateful"
C010477,Wrong,Safe,"Neutral rhetorical question about likes, not offensive"
C010479,Correct,,"Vulgar personal insult, not group-targeted"
C010481,Wrong,Safe,"Neutral political suggestion, not hateful"
C010491,Wrong,Safe,"Critical argument against movie's caste logic, warns against incited violence"
C010494,Wrong,Safe,"Political commentary, not hateful"
C010499,Wrong,Safe,"Positive statement about women's freedom, not hateful"
C010503,Wrong,Safe,"Compliment about interview, not hateful"
C010510,Unsure,,"Garbled mocking comment, unclear meaning"
C010519,Wrong,Safe,"Compliment about politician, not hateful"
C010523,Wrong,Safe,"Compliment about MLA, not hateful"
C010524,Wrong,Safe,"Neutral fan-war comment, not offensive"
C010525,Wrong,Safe,"Neutral critical opinion about remake, not offensive"
C010545,Wrong,Safe,"Fan hype comment, not hateful"
C010546,Wrong,Safe,"Mocking comment, not vulgar"
C010547,Wrong,Safe,"Critical comment about fake news, not hateful"
C010548,Wrong,Safe,"Political opinion, not hateful"
C010549,Wrong,Safe,"Compliment, not hateful"
C010551,Correct,,"Mild vulgar insult directed at Tiktok app"
C010556,Wrong,Safe,"Neutral fan speculation about disliker identity, not offensive"
C010558,Correct,,"Extremely vulgar sexual insult chain directed at named individual"
C010563,Wrong,Safe,"Mocking comment about movie title, not vulgar"
C010567,Wrong,Safe,"Metaphorical political commentary about garbage collection"
C010568,Wrong,Safe,"Vague political comment, not offensive"
C010574,Wrong,Offensive,"Curse wishing death, not clear identity-group hate"
C010578,Wrong,Safe,"Neutral motivational statement, not offensive"
C010581,Wrong,Safe,"Political support compliment, not hateful"
C010582,Wrong,Offensive,"Mocking political insult using nickname, personal not hate"
C010583,Wrong,Safe,"Critical opinion about trailer tone, not offensive"
C010587,Correct,,"Extremely vulgar sexual insult directed at named individuals"
C010589,Wrong,Offensive,"Vulgar 'dogs' insult about caste-related content, unclear identity target"
C010595,Wrong,Safe,"Critical opinion about repetitive crude content, not vulgar itself"
C010598,Unsure,,"Garbled boasting comment, unclear meaning"
C010607,Wrong,Offensive,"Vulgar mocking insult about rival actor's age"
C010609,Wrong,Safe,"Philosophical political statement, not hateful"
C010616,Wrong,Safe,"Compliment about movie's thought-provoking content"
C010621,Wrong,Safe,"Neutral movie comparison list, not offensive"
C010629,Wrong,Safe,"Tribute/praise for political figure, not hateful"
C010632,Wrong,Safe,"Political criticism, not hateful"
C010633,Wrong,Offensive,"Hostile political rhetoric against Dravidian/Dalit parties, targets parties not identity"
C010641,Wrong,Safe,"Self-deprecating joke, not hateful"
C010643,Wrong,Safe,"Mocking comment comparing appearance, not vulgar"
C010646,Wrong,Safe,"Neutral agreement comment, not hateful"
C010653,Wrong,Safe,"Neutral movie comparison, not offensive"
C010655,Wrong,Safe,"Neutral nostalgic comment about BGM inspiration"
C010660,Wrong,Safe,"Neutral speculation about movie quality, not offensive"
C010661,Wrong,Safe,"Neutral opinion about music director, not hateful"
C010664,Wrong,Safe,"Neutral comment about trailer, not offensive"
C010665,Wrong,Offensive,"Wishes someone gets hit to gain sense, rhetorical not literal threat"
C010666,Wrong,Safe,"Mocking comment about trending algorithm, not vulgar"
C010670,Wrong,Offensive,"Vulgar insult calling person a party's 'mistress', personal not group hate"
C010680,Wrong,Threat,"Explicit threat of physical violence"
C010683,Wrong,Safe,"Critical comment about content authenticity, not vulgar"
C010684,Unsure,,"Garbled comment mixing discipline and Tiktok ban opinion"
C010685,Wrong,Safe,"Political criticism about communal tensions, not hate speech itself"
C010692,Wrong,Offensive,"Judgmental moralistic comment about a woman's dance choice"
C010697,Wrong,Offensive,"Mild xenophobic dismissal about Tiktok makers, not severe hate speech"
C010698,Wrong,Safe,"Compliment about clarity, not hateful"
C010702,Wrong,Safe,"Neutral economic comment, not hateful"
C010708,Wrong,Safe,"Critical opinion about music, not hateful"
C010709,Wrong,Safe,"Neutral speculative comment about dislikers, not hateful"
C010712,Correct,,"Dehumanizing 'slave dogs' language tied to ethnic/caste ideological hostility"
C010714,Wrong,Safe,"Critical accusation of copying concept, not vulgar"
C010715,Wrong,Safe,"Political request/compliment, not hateful"
C010716,Wrong,Safe,"Neutral commentary about actor's career, not hateful"
C010731,Wrong,Safe,"Compliment about social message, not hateful"
C010737,Wrong,Safe,"Neutral speculation about dislikers, not hateful"
C010738,Wrong,Safe,"Neutral speculation about dislikers, not hateful"
C010743,Wrong,Safe,"Critical commentary condemning caste politics and divisive movies"
C010747,Wrong,Safe,"Critical opinion about movie quality, not offensive"
C010750,Wrong,Safe,"Movie tagline hype comment, not real threat"
C010758,Wrong,Safe,"Critical sarcastic comment about education system, not hateful"
C010767,Correct,,"Vulgar 'dog' insult directed at individual"
C010776,Wrong,Safe,"Political opinion, not hateful"
C010777,Wrong,Safe,"Compliment, not hateful"
C010784,Wrong,Safe,"Neutral political/factual statement, not hateful"
C010791,Unsure,,"Vague/unclear phrase, unclear meaning"
C010792,Wrong,Safe,"Mild complaint about release delay, not vulgar"
C010794,Wrong,Safe,"Neutral positive comment defending both actors"
C010805,Wrong,Safe,"Critical comment about casting choice, not vulgar"
C010808,Wrong,Offensive,"Vulgar 'dog' insult, unclear exact target but not group hate"
C010810,Wrong,Offensive,"Mild generational insult, fan/generational banter not hate speech"
C010811,Wrong,Safe,"Fan wish about actor's political future, not hateful"
C010819,Wrong,Safe,"Defensive comment about employee vs owner accountability"
C010820,Wrong,Safe,"Critical comment about spoiler trailer, not vulgar"
C010824,Correct,,"Explicit violent call to beat/kill Paraiyar caste community members"
C010830,Wrong,Safe,"Vague comment about director, unclear meaning"
C010831,Wrong,Safe,"Neutral observation, not offensive"
C010832,Wrong,Safe,"Movie tagline hype comment, not real threat"
C010834,Unsure,,"Vague technical comment, unclear meaning"
C010836,Wrong,Safe,"Mocking comment about actor's appearance, not vulgar"
C010846,Wrong,Safe,"Neutral comment about Tiktok search, not hateful"
C010847,Wrong,Safe,"Neutral movie comparison, not offensive"
C010852,Wrong,Threat,"Explicit threat to cut off those who defy, vague target"
C010855,Correct,,"Profanity directed at dislikers"
C010857,Correct,,"Extremely vulgar sexual insult chain directed at named individual"
C010861,Wrong,Safe,"Neutral comment about missing scene, not hateful"
C010866,Wrong,Hate Speech,"Vulgar xenophobic slur dehumanizing Chinese people as a national group"
C010867,Wrong,Safe,"Neutral fan comment, not hateful"
C010871,Unsure,,"Vague metaphorical comment, unclear meaning"
C010872,Wrong,Offensive,"Political mockery calling someone a fool, not hate speech"
