comment_id,verdict,corrected_category,reason
C008414,Wrong,Safe,"Neutral compliment about resemblance, not hateful"
C008416,Wrong,Offensive,"Vulgar 'dogs' insult targeting caste-obsessed people, not identity-group hate"
C008421,Wrong,Safe,"Critical opinion about acting/dubbing, not vulgar"
C008422,Wrong,Offensive,"Mocking insult about actor's appearance/health, personal not hate"
C008423,Wrong,Safe,"Neutral observation about interview reception, not hateful"
C008425,Wrong,Offensive,"Personal mocking insult about President's appearance and legitimacy"
C008426,Wrong,Safe,"Neutral fan comment about collaboration, not offensive"
C008432,Wrong,Safe,"Neutral comment about release, not offensive"
C008434,Wrong,Safe,"Fan hype comment, not offensive"
C008437,Wrong,Safe,"Neutral opinion about movie prospects, not hateful"
C008449,Wrong,Safe,"Political criticism, not hateful"
C008450,Wrong,Offensive,"Mocking comment about TV host's age, personal not hate"
C008453,Unsure,,"Garbled sarcastic comment with vulgar undertones, unclear meaning"
C008454,Wrong,Safe,"Compliment about movie's love story portrayal"
C008459,Wrong,Safe,"Critical opinion about movie genre, not vulgar"
C008463,Wrong,Safe,"Mocking sympathy comment about actor, not vulgar"
C008465,Wrong,Safe,"Political/caste-community commentary about alignment, not hateful"
C008474,Wrong,Safe,"Neutral rhetorical question, not offensive"
C008481,Wrong,Offensive,"Personal insult about politician's speaking skills, not hate speech"
C008484,Wrong,Safe,"Political corruption accusation, not hateful"
C008485,Wrong,Offensive,"Vulgar insult targeting political leader's followers, not clear group hate"
C008488,Wrong,Safe,"Fan compliment, not hateful"
C008494,Wrong,Safe,"Neutral movie comparison, not offensive"
C008498,Wrong,Safe,"Fan request for comments, not hateful"
C008499,Wrong,Safe,"Fan hype comment, not offensive"
C008501,Wrong,Safe,"Neutral reference to actor comparison, not offensive"
C008502,Unsure,,"Garbled political comment, unclear meaning"
C008505,Wrong,Safe,"Criticism of fan rivalry, not vulgar"
C008506,Wrong,Safe,"Neutral speculation about dislikers, not hateful"
C008508,Wrong,Safe,"Compliment about editing, not hateful"
C008509,Wrong,Offensive,"Vulgar insult at caste-obsessed individuals, not identity-group hate"
C008513,Wrong,Safe,"Neutral critical comment, not hateful"
C008516,Wrong,Safe,"Mocking specific commenter mildly, not vulgar"
C008517,Wrong,Safe,"Judgmental comment about a woman's life choices, not vulgar"
C008530,Wrong,Safe,"Compliment on movie, not hateful"
C008534,Correct,,"Vulgar bravado self-description"
C008538,Wrong,Offensive,"Political insult calling politician a cheat, not hate speech"
C008563,Wrong,Safe,"Compliment, not hateful"
C008571,Wrong,Offensive,"Mocking personal insult about political ineptitude, not hate speech"
C008576,Unsure,,"Vague comment, unclear meaning"
C008590,Wrong,Safe,"Compliment, not hateful"
C008593,Wrong,Offensive,"Mild insult about someone's intelligence, not hate speech"
C008607,Wrong,Safe,"Compliment about song, not hateful"
C008608,Correct,,"Extremely vulgar insult chain directed at director"
C008614,Wrong,Safe,"Neutral personal statement about viewing habits"
C008617,Wrong,Safe,"Boycott call against producer over screen allocation, not hateful"
C008622,Wrong,Safe,"Mild dismissal about VFX claim, not vulgar"
C008623,Correct,,"Caste hierarchy framing with vulgar slur, provokes caste hostility"
C008626,Wrong,Safe,"Neutral observation, not hateful"
C008627,Wrong,Safe,"Neutral observation, not offensive"
C008638,Wrong,Safe,"Fan-war boastful comparison, not offensive"
C008641,Wrong,Safe,"Mocking specific commenters mildly, not hateful"
C008643,Wrong,Safe,"Compliment, not hateful"
C008657,Wrong,Safe,"Political criticism about corruption, not offensive"
C008663,Wrong,Safe,"Critical comment about liquor quality, not hateful"
C008668,Wrong,Safe,"Mocking political comment about broken promise, not vulgar"
C008673,Wrong,Safe,"Mocking comment about arguing, not vulgar"
C008678,Wrong,Safe,"Compliment about clean entertainment, not hateful"
C008680,Unsure,,"Vague comment, possibly a warning, unclear meaning"
C008684,Unsure,,"Garbled text, unclear meaning"
C008687,Wrong,Offensive,"Vulgar personal insult at individual, not group hate"
C008690,Wrong,Safe,"Neutral comment referencing reviewer, not offensive"
C008693,Correct,,"Mild insult directed at actor Ajith"
C008695,Wrong,Safe,"Neutral comment, not offensive"
C008696,Wrong,Offensive,"Vulgar insult at director for caste-themed films, not group hate"
C008697,Correct,,"Vulgar insult directed at dislikers"
C008705,Wrong,Safe,"Neutral opinion about movie flop, not offensive"
C008721,Wrong,Sexual Harassment,"Extremely vulgar explicit sexual harassment targeting named actress"
C008723,Wrong,Safe,"Neutral comment about music familiarity, not offensive"
C008726,Unsure,,"Garbled text, unclear meaning"
C008728,Wrong,Safe,"Nostalgic comment about movie support, not hateful"
C008733,Wrong,Safe,"Political criticism calling party fraudulent, not group hate"
C008735,Wrong,Safe,"Critical comment about double standards in criticizing music theft"
C008737,Wrong,Safe,"Personal opinion about lost respect, not vulgar"
C008739,Wrong,Safe,"Neutral reference to religious festival, not hateful"
C008743,Wrong,Safe,"Political praise, not hateful"
C008746,Wrong,Safe,"Criticism of fan rivalry, not vulgar"
C008750,Wrong,Safe,"Tribute/compliment, not hateful"
C008753,Wrong,Safe,"Regional pride comment, not hateful"
C008761,Wrong,Safe,"Neutral positive comment, not hateful"
C008767,Wrong,Safe,"Compliment/encouragement, not hateful"
C008779,Wrong,Offensive,"Vulgar call to chase BJP out of Telangana, targets party not group"
C008782,Correct,,"Vulgar insult at named individual"
C008784,Unsure,,"Garbled text, unclear meaning"
C008789,Correct,,"Mocking insult about director's mental health"
C008798,Wrong,Safe,"Fan praise, not hateful"
C008799,Unsure,,"Vague comment, unclear meaning"
C008805,Correct,,"Vulgar insult chain directed at named individual"
C008814,Wrong,Offensive,"Political criticism calling for symbolic slipper-beating, not literal threat"
C008816,Correct,,"Vulgar insult directed at specific woman"
C008818,Wrong,Safe,"Fan pride comment, not hateful"
C008819,Unsure,,"Vague phrase, unclear meaning"
C008827,Wrong,Safe,"Neutral comparison, not offensive"
C008830,Wrong,Safe,"Fan request about music theme, not offensive"
C008834,Wrong,Safe,"Mocking sympathy comment about actor, not hateful"
C008837,Wrong,Safe,"Neutral comment, not hateful"
C008838,Wrong,Safe,"Political comparison, not hateful"
C008860,Wrong,Safe,"Critical comment about director's frequent projects, not vulgar"
C008863,Wrong,Safe,"Mocking comment about director's projects, not hateful"
C008870,Wrong,Safe,"Critical rhetorical question about hypocrisy, not vulgar"
C008871,Wrong,Safe,"Neutral request, not offensive"
C008872,Wrong,Safe,"Neutral movie comparison, not offensive"
C008878,Wrong,Safe,"Compliment, not hateful"
C008882,Unsure,,"Vague comment, possibly sarcastic, unclear meaning"
C008885,Wrong,Safe,"Neutral stats question, not offensive"
C008889,Wrong,Offensive,"Mild insult calling critics crazy, fan-war trash talk"
C008892,Wrong,Safe,"Neutral complaint about delay, not offensive"
C008897,Correct,,"Transphobic slur used to question casting, combined with vulgar insult"
C008908,Wrong,Safe,"Critical commentary about caste-based conflict, not explicit hate speech"
C008912,Wrong,Safe,"Compliment, not hateful"
C008913,Wrong,Offensive,"Mocking insult calling group mental, unclear if identity-based"
C008915,Wrong,Safe,"Compliment about courage, not hateful"
C008917,Correct,,"Mocking insult about actor's age"
C008920,Wrong,Safe,"Critical opinion about trailer content, not vulgar"
C008923,Unsure,,"Vague teasing comment, unclear meaning"
C008926,Wrong,Safe,"Critical opinion about movie direction, not hateful"
C008940,Wrong,Offensive,"Vulgar insult calling politician dog-faced, not group hate"
C008950,Wrong,Safe,"Anti-caste statement advocating merit over caste, not hateful"
C008951,Wrong,Safe,"Compliment, not hateful"
C008952,Wrong,Offensive,"Hostile political criticism dismissing caste oppression narrative and anti-caste directors"
C008960,Wrong,Safe,"Compliment, not hateful"
C008961,Wrong,Offensive,"Political insult calling someone a traitor, personal not hate"
C008962,Unsure,,"Vague comment, unclear meaning"
C008968,Wrong,Offensive,"Vulgar insult condemning caste system, not identity-group hate"
C008970,Wrong,Safe,"Mocking wordplay criticism about movie, not vulgar"
C008977,Unsure,,"Vague comment, unclear meaning"
C008985,Wrong,Safe,"Critical opinion about movie budget/quality, not hateful"
C008987,Wrong,Safe,"Neutral opinion about marketing budget, not offensive"
C008991,Wrong,Offensive,"Mild insult about family, personal not hate"
C008994,Wrong,Safe,"Fan hype comment, not offensive"
C008995,Wrong,Offensive,"Mocking mild threat framing about deleting app, not real threat"
C009001,Wrong,Safe,"Neutral question about music, not offensive"
C009008,Correct,,"Vulgar insult directed at individual"
C009009,Unsure,,"Vague comment, unclear meaning"
C009012,Wrong,Safe,"Neutral agreement comment, not hateful"
C009016,Wrong,Safe,"Critical opinion about fan hype claims, not vulgar"
C009023,Wrong,Safe,"Compliment on dance, not hateful"
C009024,Wrong,Safe,"Critical comment about regional film bias, not vulgar"
C009025,Wrong,Safe,"Compliment, not hateful"
C009029,Correct,,"Vulgar personal insult, not group hate"
C009033,Wrong,Safe,"Neutral comment, not offensive"
C009038,Wrong,Safe,"Compliment, not hateful"
C009043,Wrong,Safe,"Compliment about movie's success, not hateful"
C009048,Correct,,"Vulgar insult chain directed at named individual"
C009050,Wrong,Safe,"Critical opinion about judging quality, not hateful"
C009051,Wrong,Offensive,"Personal insult about hypocrisy on law, targets individual"
C009060,Wrong,Safe,"Anti-caste sentiment, rhetorical slipper-beating idiom not real threat"
C009063,Unsure,,"Vague comment, unclear meaning"
C009070,Wrong,Offensive,"Hostile metaphor about exposing directors, not clear group hate"
C009073,Wrong,Safe,"Critical comment about director collaboration, not vulgar"
C009078,Wrong,Offensive,"Criticism of religious figures as womanizers, not group-targeted hate"
C009089,Wrong,Safe,"Harsh political opinion about voters, not hateful"
C009091,Unsure,,"Garbled text about COVID, unclear meaning"
C009096,Wrong,Safe,"Neutral hype comment, not hateful"
C009097,Wrong,Safe,"Fan hype/movie quote, not offensive"
C009102,Wrong,Safe,"Compliment about actress's role choices, not hateful"
C009107,Wrong,Safe,"Fan-war opinion about movie choice, not offensive"
C009109,Correct,,"Mild insult calling director a jester"
C009111,Wrong,Safe,"Neutral request about interview conduct, not hateful"
C009116,Wrong,Safe,"Neutral comment about movie feel, not offensive"
C009119,Wrong,Offensive,"Vulgar mocking comment about movie romance, not hate speech"
C009120,Wrong,Safe,"Neutral fan-war comment about trailer comparison, not offensive"
C009124,Wrong,Safe,"Neutral suggestion against piracy, not hateful"
C009125,Wrong,Safe,"Critical opinion about industry standards, not hateful"
C009133,Wrong,Safe,"Sarcastic anti-caste-discrimination argument, not real hate speech"
C009145,Wrong,Safe,"Neutral comparison, not offensive"
C009151,Wrong,Offensive,"Mocking insult calling commenters crazy fools"
C009160,Wrong,Safe,"Neutral comment about movie availability, not offensive"
C009166,Wrong,Safe,"Compliment about movie publicity, not hateful"
C009169,Wrong,Safe,"Harsh generalization about people's sense, not hate speech"
C009171,Wrong,Safe,"Critical comment about spoiler trailers, not vulgar"
C009174,Wrong,Safe,"Neutral opinion about sequel movies, not hateful"
C009175,Unsure,,"Garbled text, unclear meaning"
C009178,Wrong,Offensive,"Political insult calling CM wretched, not hate speech"
C009183,Wrong,Safe,"Compliment, not hateful"
C009187,Wrong,Offensive,"Extremely vulgar sexual insult at named individual"
C009193,Wrong,Safe,"Neutral positive comment, not offensive"
C009204,Wrong,Safe,"Critical industry commentary about hero hierarchy, not hateful"
C009210,Wrong,Safe,"Neutral opinion, not offensive"
C009211,Wrong,Safe,"Positive comment about genre, not offensive"
C009212,Wrong,Offensive,"Mild insult about someone's face/appearance, personal not hate"
C009213,Wrong,Safe,"Neutral stats comment, not offensive"
C009218,Wrong,Safe,"Neutral comparison, not offensive"
C009222,Wrong,Safe,"Neutral comment about piracy impact, not offensive"
C009225,Wrong,Safe,"Negative opinion about movie quality, not hateful"
C009227,Wrong,Safe,"Mild criticism about overacting, not hateful"
C009229,Wrong,Safe,"Argues against caste-blame narrative, defends women's agency"
C009230,Wrong,Safe,"Neutral fan question, not offensive"
C009240,Wrong,Safe,"Negative opinion about movie, not vulgar"
C009241,Wrong,Safe,"Compliment about music, not offensive"
C009244,Wrong,Safe,"Compliment, not hateful"
C009252,Wrong,Safe,"Political criticism about state debt, not hateful"
C009261,Wrong,Safe,"Critical opinion about overhype, not vulgar"
C009267,Wrong,Safe,"Critical comment about nepotism, not vulgar"
C009276,Correct,,"Vulgar term used describing entry scene"
C009288,Wrong,Safe,"Political criticism about politician's importance, not hateful"
C009290,Wrong,Safe,"Compliment, not hateful"
C009295,Wrong,Offensive,"Mocking insult calling someone a drunkard, personal not hate"
C009297,Wrong,Safe,"Positive opinion about movie, not offensive"
C009299,Wrong,Safe,"Mocking comparison comment, not offensive"
C009300,Wrong,Safe,"Compliment about honesty, not hateful"
C009301,Correct,,"Caste pride framing with explicit violent threat language"
C009311,Wrong,Safe,"Philosophical political statement, not hateful"
C009316,Wrong,Safe,"Neutral comment about fuel prices, not hateful"
C009319,Correct,,"Mocking insult about actress's health/appearance"
C009323,Wrong,Safe,"Neutral comment about dancers, not hateful"
C009325,Correct,,"Provocative caste hierarchy taunt calling commenters lower caste/slaves"
C009327,Wrong,Safe,"Tribute/compliment about political struggle, not hateful"
C009334,Wrong,Offensive,"Personal insult at politician/actor family, not group hate"
C009339,Wrong,Safe,"Brief remark calling someone talkative, not hateful"
C009342,Wrong,Offensive,"Long political insult using vulgar dismissals, targets individual not protected group"
C009346,Wrong,Safe,"Neutral question about movie genre, not hateful"
C009352,Wrong,Safe,"Compliment about interview, not hateful"
C009357,Wrong,Safe,"Critical movie review, not hateful"
C009368,Wrong,Safe,"Comment praising unbiased fan behavior, not offensive"
C009371,Correct,,"Vulgar insult directed at individual actor"
C009373,Wrong,Safe,"Political commentary praising people's awareness, not hateful"
C009386,Wrong,Safe,"Personal anecdote about movie timing, not hateful"
C009390,Correct,,"Personal insult directed at director, not group hate"
C009391,Wrong,Safe,"Neutral opinion about movie, not offensive"
C009394,Wrong,Safe,"Sarcastic political comment, not hateful"
C009397,Wrong,Safe,"Neutral comment about casting, not offensive"
C009399,Correct,,"Vulgar caste-based slur ('caste dogs') targeting group"
C009403,Wrong,Threat,"Explicit threat of violence (beating), quoted approvingly"
C009405,Wrong,Safe,"Neutral comment about scene, not offensive"
C009407,Wrong,Offensive,"Vulgar insult about acting quality, not group hate"
C009410,Wrong,Safe,"Fan hype comment, not offensive"
C009414,Wrong,Safe,"Casual comment about appearance, not hateful"
C009419,Wrong,Safe,"Neutral question about actors, not hateful"
C009423,Unsure,,"Garbled text, unclear meaning"
C009425,Wrong,Safe,"Critical movie comparison, not hateful"
C009430,Wrong,Safe,"Neutral question about song, not hateful"
C009431,Wrong,Safe,"Request for interview, not hateful"
C009432,Correct,,"Vulgar sexual insult directed at individual"
C009438,Wrong,Safe,"Compliment about dancer, not hateful"
C009442,Correct,,"Vulgar insult directed at political party"
C009443,Wrong,Safe,"Neutral reference to Tiktok, not hateful"
C009447,Wrong,Safe,"Political criticism about road development, not hateful"
C009448,Wrong,Safe,"Speculation about dislike group, not hateful"
C009450,Unsure,,"Garbled text, unclear meaning"
C009452,Wrong,Offensive,"Fan-war insult directed at rival fanbase, not group hate"
C009456,Wrong,Safe,"Opinion about actor's screen presence, not hateful"
C009457,Correct,,"Vulgar threat-like insult directed at individual"
C009463,Wrong,Safe,"Compliment about achieving success, not hateful"
C009465,Wrong,Safe,"Sarcastic comment about director, not offensive"
C009466,Wrong,Safe,"Comment about actor's expression, not offensive"
C009473,Wrong,Safe,"Comment about costume choices, not hateful"
C009474,Unsure,,"Garbled fragment referencing fighting/death, unclear meaning"
C009475,Correct,,"Vulgar insult directed at individual"
C009477,Wrong,Safe,"Sarcastic comment about political entry timing, not hateful"
C009479,Wrong,Safe,"Comment about piracy site usage, not offensive"
C009482,Wrong,Safe,"Comparison between actors, not offensive"
C009485,Wrong,Safe,"Comment addressed to director, not offensive"
C009486,Wrong,Safe,"Sarcastic comment about timeline inconsistency, not hateful"
C009489,Correct,,"Casteist accusation defending rapist due to caste, targets caste group"
C009495,Wrong,Safe,"Compliment about comedic timing, not hateful"
C009502,Wrong,Safe,"Fan hype comment, not offensive"
C009503,Wrong,Safe,"Compliment about comedic timing, not hateful"
C009511,Wrong,Safe,"Comment praising humility/respect for farmers, not hateful"
C009512,Wrong,Safe,"Critical political opinion, not hateful"
C009513,Wrong,Safe,"Comment about roast video content, not hateful"
C009516,Wrong,Offensive,"Criticism suggesting replacing music director, not group hate"
C009530,Wrong,Safe,"Fan comment about trailer, not offensive"
C009531,Correct,,"Vulgar insult directed at individual actor"
C009539,Correct,,"Extremely vulgar sexual insult chain directed at individual"
C009545,Wrong,Safe,"Sarcastic comment about actor's image, not offensive"
C009547,Wrong,Safe,"Comment about casting suitability, not offensive"
C009553,Wrong,Safe,"Comment about friendship/social media likes, not hateful"
C009557,Wrong,Safe,"Compliment about politician's sincerity, not hateful"
C009559,Wrong,Safe,"Political/social commentary about Tiktok/China, not hateful"
C009561,Wrong,Safe,"Comment about voice reaction, not offensive"
C009564,Wrong,Safe,"Comment urging honest promotion, not hateful"
C009567,Wrong,Safe,"Request against actor doing action films, not offensive"
C009570,Correct,,"Vulgar insult about trailer quality"
C009573,Wrong,Safe,"Question about genre confusion, not hateful"
C009576,Wrong,Safe,"Sarcastic comment about fan behavior, not offensive"
C009583,Wrong,Safe,"Question about trailer viewing, not offensive"
C009588,Wrong,Safe,"Criticism about poor quality products, not hateful"
C009593,Wrong,Safe,"Accusation of lying, not hateful"
C009597,Wrong,Safe,"Request about trailer spoilers, not offensive"
C009599,Wrong,Safe,"Political criticism about clergy in politics, not hateful"
C009602,Wrong,Safe,"Compliment about video timing/motivation, not hateful"
C009603,Wrong,Safe,"Sarcastic political commentary, not hateful"
C009604,Wrong,Safe,"Comment about mass dialogue movies, not offensive"
C009620,Wrong,Safe,"Comparison praising actor over politician, not hateful"
C009621,Wrong,Safe,"Political criticism about caste exploitation, not hateful"
C009626,Wrong,Safe,"Political criticism about permissions/violence, not hateful"
C009629,Wrong,Safe,"Comment about sound effects, not offensive"
C009630,Wrong,Safe,"Comment comparing content severity, not hateful"
C009632,Wrong,Threat,"Wishing death upon dislikers"
C009637,Wrong,Safe,"Comment about actor's solo performance, not hateful"
C009644,Wrong,Offensive,"Insult calling people waste, not group hate"
C009649,Wrong,Safe,"Compliment about actor's comic presence, not hateful"
C009650,Wrong,Safe,"Comment about trailer anticipation, not offensive"
C009656,Wrong,Safe,"Fan hype comment, not offensive"
C009658,Wrong,Safe,"Fan hype comparison to superhero films, not offensive"
C009666,Wrong,Safe,"Compliment about movie, not hateful"
C009668,Wrong,Safe,"Opinion against actor entering politics, not offensive"
C009669,Wrong,Offensive,"Insult calling dislikers jealous, not group hate"
C009672,Wrong,Safe,"Political criticism, not hateful"
C009673,Correct,,"Caste-based dehumanizing slur ('dogs') targeting caste-obsessed people"
C009676,Wrong,Safe,"Opinion about movie's lack of audience, not offensive"
C009678,Wrong,Offensive,"Vulgar insult directed at politicians, not group hate"
C009679,Wrong,Safe,"Sarcastic comment about dislikers, not offensive"
C009683,Wrong,Offensive,"Accusation of causing harm to community movement, targets individual"
C009697,Wrong,Offensive,"Dehumanizing insult comparing film/subject to street dog"
C009700,Wrong,Offensive,"Insult calling someone an idiot, not group hate"
C009703,Wrong,Safe,"Neutral comment about movie ownership, not offensive"
C009712,Wrong,Offensive,"Mocking insult using gendered comparison, personal not hate"
C009716,Wrong,Safe,"Philosophical rhetorical statement about perception, not hate speech"
C009725,Wrong,Safe,"Positive message about peace, not hateful"
C009729,Wrong,Safe,"Joking comment about actor, not hateful"
C009737,Wrong,Safe,"Comment about fan loyalty and respect, not offensive"
C009738,Correct,,"Vulgar personal insult, garbled fan comment"
C009739,Correct,,"Extremely vulgar sexual insult referencing family"
C009740,Wrong,Safe,"Compliment about performance/appearance, not hateful"
C009742,Wrong,Safe,"Movie-themed tagline with caste community greeting, not real threat"
C009747,Wrong,Safe,"Critical comment about gender double standard in workplace, not hate speech"
C009750,Wrong,Hate Speech,"Vulgar xenophobic slur targeting Chinese people as a group"
C009766,Wrong,Safe,"Positive comment about movie, not hateful"
C009767,Wrong,Safe,"Neutral observation about cameo, not hateful"
C009771,Correct,,"Vulgar sexual solicitation-mocking insult at named individual"
C009776,Wrong,Safe,"Joking comment about food, not offensive"
C009777,Correct,,"Mocking rival fanbase nickname"
C009779,Unsure,,"Vague comment about media, unclear meaning"
C009788,Wrong,Offensive,"Political criticism calling followers 'brainwashed sheep', not protected-group hate"
C009791,Wrong,Safe,"Neutral comment about dislikes/views, not offensive"
C009793,Wrong,Safe,"Critical comment about trailer length, not offensive"
C009803,Wrong,Safe,"Recommends movie to Hindu audience specifically, not hate speech"
C009804,Wrong,Offensive,"Vulgar mocking insult about someone's voice quality"
C009805,Wrong,Offensive,"Insult calling someone a fool during argument, not group hate"
C009808,Wrong,Safe,"Mocking comment about political figures' fan reaction, not hateful"
C009811,Wrong,Safe,"Compliment, not hateful"
C009834,Wrong,Offensive,"Defends movie's anti-inter-caste-romance narrative, not explicit hate speech itself"
C009836,Wrong,Safe,"Mild comment about legal action threat, not vulgar"
C009837,Wrong,Safe,"Neutral question about remake, not offensive"
C009849,Wrong,Safe,"Social commentary about superhero movies, not offensive"
C009850,Wrong,Safe,"Political mocking comment about language skills, not hateful"
C009853,Unsure,,"Vague comment, possibly innuendo, unclear meaning"
C009855,Wrong,Safe,"Compliment about police officer, not hateful"
C009858,Wrong,Offensive,"Caste community pride framing with confrontational challenge"
C009860,Wrong,Safe,"Neutral fan opinion about movie tone, not offensive"
C009861,Wrong,Safe,"Critical comment accusing filmmakers of provoking caste issues, not hate speech itself"
C009866,Wrong,Safe,"Tribute/compliment, not hateful"
C009867,Unsure,,"Vague personal statement, unclear meaning"
C009871,Wrong,Safe,"Compliment/suggestion about choreographer, not hateful"
C009877,Wrong,Safe,"Negative opinion about movie quality, not vulgar"
C009880,Wrong,Offensive,"Sarcastic dismissive comment about Dalit discourse sensitivity"
C009881,Wrong,Safe,"Tribute/condolence, not hateful"
C009887,Wrong,Threat,"Mocking suggestion for named commenter to eat poison"
C009889,Unsure,,"Vague comment, unclear meaning"
C009898,Wrong,Safe,"Compliment about reviewer, not hateful"
C009903,Wrong,Safe,"Compliment about dialogues, not hateful"
C009915,Wrong,Safe,"Philosophical political statement, not hateful"
C009916,Wrong,Offensive,"Derogatory term used to mock unnamed actor, personal insult"
C009920,Wrong,Safe,"Compliment about song/scenes, not hateful"
C009926,Wrong,Safe,"Challenging comment about legal proceedings, not vulgar"
C009932,Wrong,Safe,"Comment about lineage, not hateful"
C009947,Wrong,Safe,"Neutral stats comment about trending, not offensive"
C009959,Wrong,Safe,"Religious chant, not hateful"
C009962,Wrong,Offensive,"Derogatory term calling movie 'garbage' in fan-war comparison"
C009963,Wrong,Safe,"Criticism of fan rivalry, not vulgar"
C009969,Wrong,Offensive,"Fan-war trash talk dismissing rival actor"
C009971,Unsure,,"Vague comment, unclear meaning"
C009972,Wrong,Safe,"Critical opinion about actor's acting skills, not vulgar"
C009974,Wrong,Safe,"Compliment about speech, not hateful"
C009979,Wrong,Safe,"Well-wishes for movies, not hateful"
C009984,Wrong,Safe,"Neutral speculative joke about dislikers, not offensive"
C009985,Wrong,Safe,"Fan hype comment, not offensive"
C009991,Wrong,Safe,"Compliment, not hateful"
C009995,Wrong,Safe,"Compliment about dialogues, not hateful"
C010008,Wrong,Safe,"Negative opinion about movie, not hateful"
C010016,Unsure,,"Vague comment, unclear meaning"
C010017,Wrong,Safe,"Compliment about cricketer as role model, not hateful"
C010018,Wrong,Safe,"Critical accusation of copying short film, not hateful"
