comment_id,verdict,corrected_category,reason
C037799,Correct,,"Vulgar personal insult at individual"
C037803,Wrong,Safe,"Mild questioning comment, no offense"
C037805,Wrong,Offensive,"Mild insult calling someone foolish"
C037806,Wrong,Safe,"Mocking wordplay comparison, no offense"
C037808,Wrong,Safe,"Neutral comment, no hate"
C037813,Correct,,"Caste-based vulgar insult targeting Vanniyar community"
C037819,Wrong,Safe,"Agreement/praise comment, no hate"
C037823,Correct,,"Emasculating insult used in hypocrisy joke"
C037824,Wrong,Safe,"Fan hype quoting movie dialogue, not real threat"
C037825,Wrong,Safe,"Neutral movie success wish, no hate"
C037827,Wrong,Safe,"Mild taunt, no offense"
C037829,Wrong,Safe,"Fan hype comment, no offense"
C037831,Wrong,Safe,"Caste-pride comment calling out selective celebration hypocrisy, not hateful"
C037841,Wrong,Safe,"Mild mocking comment at dislikers, not offensive"
C037845,Wrong,Safe,"Praise with mild concern, no offense"
C037847,Correct,,"Extremely vulgar personal insult at actor"
C037851,Wrong,Safe,"Neutral/praise comment, no hate"
C037853,Wrong,Safe,"Political/legal criticism, no hate"
C037856,Wrong,Offensive,"Mild insult calling critics incapable"
C037858,Wrong,Offensive,"Vulgar phrase, unclear specific target"
C037860,Wrong,Safe,"Harsh political criticism about government shamelessness, no hate"
C037863,Wrong,Safe,"Conspiracy theory joke about fandom, no hate"
C037867,Wrong,Safe,"Harsh political criticism calling party evil force, no hate speech"
C037871,Unsure,,"Unclear short fragment, ambiguous"
C037875,Wrong,Offensive,"Mild mocking comment at commenter trolling actors"
C037888,Wrong,Safe,"Mild fan banter, hyperbolic expression not literal"
C037889,Wrong,Safe,"Fan hype praise, no offense"
C037890,Wrong,Safe,"Tribute/praise comment, no hate"
C037893,Wrong,Safe,"Fan hype hyperbolic boast, not real threat"
C037899,Wrong,Safe,"Neutral hype comment, no offense"
C037900,Wrong,Safe,"Mild complaint about ads, no hate"
C037907,Wrong,Safe,"Unclear casual comment, no hate"
C037913,Wrong,Safe,"Praise comment, no hate"
C037914,Correct,,"Vulgar personal insult at dislikers"
C037917,Wrong,Threat,"Explicit threat of violence to protect land/women, with caste identity framing"
C037925,Wrong,Safe,"Neutral speculation about dislikers, no hate"
C037933,Wrong,Safe,"Harsh critical movie review, no hate speech"
C037941,Wrong,Safe,"Neutral speculation about dislikers, no hate"
C037948,Wrong,Offensive,"Vulgar insult at trolls"
C037949,Wrong,Safe,"Criticism of film industry planning, no hate"
C037950,Unsure,,"Unclear fragment, ambiguous meaning"
C037952,Wrong,Offensive,"Hostile hyperbolic insult implying deserved public humiliation"
C037960,Wrong,Offensive,"Dehumanizing breed insult with xenophobic undertone at individual"
C037961,Wrong,Safe,"Neutral movie comparison, no hate"
C037970,Correct,,"Vulgar personal insult"
C037971,Wrong,Safe,"Critical comment, no offense"
C037974,Wrong,Safe,"Praise comment, no hate"
C037975,Wrong,Offensive,"Vulgar insult at movie/makers"
C037980,Unsure,,"Unclear fragment, ambiguous meaning"
C037986,Wrong,Safe,"Mild mocking comment about hairstyle, not offensive"
C037987,Wrong,Safe,"Neutral question, no offense"
C037989,Wrong,Safe,"Praise comment, no hate"
C037998,Wrong,Safe,"Neutral stats observation, no offense"
C038003,Wrong,Offensive,"Vulgar slang used in fan hype, mild"
C038004,Wrong,Safe,"Neutral observation, no offense"
C038016,Wrong,Offensive,"Dehumanizing dog insult at rival actors in fan praise"
C038017,Correct,,"Personal insult at actor"
C038023,Wrong,Offensive,"Political insult implying subservience"
C038025,Wrong,Safe,"Incomplete neutral fragment, no offense"
C038028,Wrong,Safe,"Neutral speculative comment about movie rivalry, no offense"
C038029,Wrong,Safe,"Fan request comment, no offense"
C038035,Wrong,Safe,"Critical comment about portrayal accuracy, no offense"
C038037,Unsure,,"Unclear insult, possibly caste-related term, ambiguous"
C038040,Wrong,Safe,"Critical comment about director's style, no hate"
C038049,Wrong,Safe,"Blessing/praise comment, no hate"
C038050,Wrong,Safe,"Sports comment, no hate"
C038053,Wrong,Safe,"Praise comment, no hate"
C038054,Wrong,Safe,"Neutral comment about production, no offense"
C038056,Correct,,"Mild personal insult (clown) at director"
C038058,Wrong,Offensive,"Hostile wish for violence against actress"
C038059,Correct,,"Extremely vulgar insult chain"
C038061,Wrong,Safe,"Neutral movie comparison, no offense"
C038066,Wrong,Safe,"Fan hype comment, no offense"
C038069,Wrong,Safe,"Neutral linguistic commentary, no offense"
C038077,Wrong,Safe,"Praise for patriotic movie message, no hate"
C038078,Wrong,Safe,"Fan hype comment, no offense"
C038080,Wrong,Safe,"Unclear mild question, no hate"
C038084,Wrong,Safe,"Neutral accusatory question, no hate"
C038089,Correct,,"Vulgar personal insult at director"
C038093,Wrong,Offensive,"Mild insult questioning someone's basic sense"
C038095,Wrong,Offensive,"Mild insult calling someone psycho"
C038098,Wrong,Safe,"Vague social commentary about work/family responsibility, no hate"
C038102,Wrong,Safe,"Fan concern comment about image, no hate"
C038112,Wrong,Safe,"Critical observation about VFX/casting, no hate"
C038115,Wrong,Safe,"Praise comment, no hate"
C038118,Unsure,,"Unclear political insult, ambiguous meaning"
C038121,Wrong,Safe,"Vague dismissive comment, no hate"
C038124,Wrong,Safe,"Well-wishing comment, no hate"
C038131,Wrong,Safe,"Neutral stats comparison, no offense"
C038133,Correct,,"Vulgar personal insult/rant at filmmakers"
C038134,Wrong,Safe,"Environmental/social commentary, no hate"
C038135,Correct,,"Caste-pride assertion with explicit warning/threat to rival group"
C038137,Wrong,Offensive,"Vague vulgar insult/threat-like phrase"
C038139,Wrong,Safe,"Neutral question, no offense"
C038140,Wrong,Offensive,"Vulgar political insult at politicians as a group"
C038158,Wrong,Safe,"Praise comment, no hate"
C038159,Correct,,"Explicit caste-based hate speech denigrating Dalits and their leaders"
C038161,Unsure,,"Ambiguous caste-related generalization, unclear intent"
C038166,Unsure,,"Unclear vulgar-sounding phrase, ambiguous meaning"
C038168,Wrong,Safe,"Mild mocking reaction comment, no offense"
C038169,Correct,,"Vulgar personal insult at individual"
C038170,Wrong,Safe,"Mocking comment about political indecision, no vulgar insult"
C038175,Wrong,Safe,"Mild criticism of comment culture, no offense"
C038181,Wrong,Offensive,"Mocking comparison insult about actor's stature"
C038183,Wrong,Safe,"Critical comparison opinion, no hate"
C038185,Wrong,Safe,"Mild criticism using idiom, no hate"
C038186,Wrong,Safe,"Anti-caste-violence commentary calling for movie ban, not itself hateful"
C038187,Wrong,Safe,"Mild criticism of video quality, no offense"
C038194,Wrong,Safe,"Neutral movie industry comment, no hate"
C038198,Wrong,Safe,"Factual correction comment, no offense"
C038200,Wrong,Offensive,"Mild insult mocking someone acting like a big hero"
C038201,Wrong,Safe,"Neutral fan comment, no offense"
C038203,Wrong,Offensive,"Hostile political taunt about upcoming trouble"
C038215,Wrong,Threat,"Explicit threat of violence to protect land/women"
C038216,Correct,,"Dehumanizing dogs insult at dislikers"
C038217,Wrong,Safe,"Patriotic critical commentary, no hate"
C038219,Wrong,Safe,"Praise comment, no hate"
C038221,Wrong,Safe,"Neutral stats observation, no offense"
C038224,Wrong,Safe,"Critical philosophical commentary about caste and money hypocrisy, not hateful"
C038228,Wrong,Safe,"Neutral movie comparison, no offense"
C038229,Wrong,Safe,"Mocking joke about dialogue references, no offense"
C038231,Wrong,Safe,"Unclear neutral commentary, no offense"
C038232,Wrong,Safe,"Critical comment about directors' repetitive storytelling, no hate"
C038236,Wrong,Safe,"Praise for confronting media, mild criticism not hateful"
C038238,Wrong,Offensive,"Mocking joke with mild insult (clown fan) at rival fans"
C038239,Wrong,Safe,"Mocking observation about movie referencing rival stars, no hate"
C038247,Wrong,Safe,"Unclear commentary about mindset over age, no hate"
C038250,Wrong,Offensive,"Mocking dismissive insult implying domestic role"
C038256,Wrong,Safe,"Political pride/support statement, no hate"
C038263,Wrong,Safe,"Praise comment, no hate"
C038268,Wrong,Safe,"Neutral stats comment, no hate"
C038271,Wrong,Safe,"Neutral question about character, no offense"
C038276,Unsure,,"Garbled text, meaning unclear"
C038280,Wrong,Safe,"Praise comment, no hate"
