comment_id,verdict,corrected_category,reason
C032508,Wrong,Offensive,"Insult implying dependency, not group hate"
C032514,Wrong,Safe,Fan hype phrase
C032515,Correct,,Vulgar insult at recurring troll target
C032522,Wrong,Safe,"Praise for actor, no hate"
C032527,Wrong,Offensive,"Insult comparing song to someone's face, not group hate"
C032539,Unsure,,"Vague joke, not offensive"
C032542,Wrong,Safe,"Fan war call to action, no hate"
C032544,Wrong,Safe,"Fan comment about movie/award, not offensive"
C032545,Wrong,Safe,"Comment about train horn, no hate"
C032548,Unsure,,"Unclear personal comment, ambiguous"
C032554,Wrong,Safe,"Praise for political leader, no hate"
C032557,Wrong,Threat,Poetic explicit threat of violence against anyone touching land/women
C032564,Wrong,Safe,"Philosophical warning about karma, not offensive"
C032565,Wrong,Hate Speech,Idiomatic threat targeting caste-rights-associated public figures
C032575,Wrong,Safe,"Mild opinion about movie choices, not offensive"
C032576,Wrong,Safe,Neutral observation about similarity
C032581,Wrong,Safe,"Political family comment, no hate"
C032584,Wrong,Safe,Neutral fan comment
C032587,Wrong,Offensive,"Severe personal accusation with vulgar insult, not group hate"
C032599,Wrong,Safe,"Praise, no hate"
C032606,Wrong,Safe,"Joking movie opinion, no hate"
C032608,Wrong,Safe,"Population control opinion, no hate"
C032609,Wrong,Safe,"Fan comment about fanbase preference, no hate"
C032610,Wrong,Safe,"Joke about brand relaunch, no hate"
C032616,Wrong,Safe,"Critique about sequels, no hate"
C032620,Wrong,Safe,"Praise for movie relatability, no hate"
C032629,Unsure,,"Vague personal comment, not offensive"
C032638,Correct,,Fan war insult with censored word
C032643,Unsure,,"Vague comment about farming/village, not offensive"
C032646,Unsure,,"Unclear insult phrase, ambiguous"
C032647,Wrong,Safe,"Dismissive expression, mild not offensive"
C032653,Wrong,Offensive,"Mild personal insult, not group hate"
C032659,Wrong,Safe,Neutral fan reference comment
C032661,Correct,,Insult calling other-language movie viewers trash
C032666,Wrong,Offensive,"Odd political insult, not group hate"
C032667,Wrong,Safe,"Negative review, mild not offensive"
C032670,Wrong,Safe,"Praise, no hate"
C032671,Wrong,Safe,Neutral movie reference
C032675,Wrong,Safe,Neutral stats comment
C032678,Wrong,Safe,"Movie industry commentary, no hate"
C032681,Wrong,Safe,"Praise about confidence, no hate"
C032684,Wrong,Safe,"Fan war speculation, no hate"
C032690,Unsure,,"Vague warning, ambiguous intent"
C032693,Correct,,Vulgar political insult at dislikers
C032699,Wrong,Safe,"Neutral observation about fan culture, no hate"
C032700,Wrong,Safe,"Mild mocking nickname, not offensive"
C032701,Wrong,Safe,"Defiant political statement, no hate"
C032725,Wrong,Safe,"Social criticism about liquor stores, no hate"
C032728,Wrong,Safe,"Anti-caste-discrimination statement, no hate"
C032729,Wrong,Offensive,"Vulgar dismissive phrase, not group hate"
C032737,Wrong,Offensive,"Insult directed at China, not core protected-group hate"
C032742,Wrong,Safe,Neutral observation about trailer
C032743,Wrong,Safe,"Positive political statement, no hate"
C032746,Wrong,Safe,"Mild observation about fan behavior, no hate"
C032751,Correct,,Hyperbolic fan threat mixed with hype
C032760,Wrong,Safe,Neutral industry observation
C032767,Wrong,Safe,Accusation of copying music
C032768,Wrong,Safe,"Political comment, no hate"
C032779,Wrong,Safe,Negative movie prediction
C032780,Wrong,Safe,"Fan war stats comparison, no hate"
C032781,Correct,,Mocking insult at individual
C032782,Wrong,Safe,Neutral opinion about trailer
C032784,Wrong,Offensive,"Vulgar dismissive comparison, not group hate"
C032785,Wrong,Safe,"Praise, no hate"
C032789,Unsure,,"Ambiguous political accusation about a killing, unclear intent"
C032793,Wrong,Safe,"Critique about repeated box office flops, not offensive"
C032799,Wrong,Safe,"Praise, no hate"
C032802,Correct,,Personal insult at director mixed with fan praise
C032806,Correct,,Insult calling people crooks with dark humor
C032807,Wrong,Safe,"Accusation about inserting BGM, mild not offensive"
C032812,Unsure,,"Vague idiom about movie flopping, not offensive"
C032818,Wrong,Safe,"Fan hype comment about likes, no hate"
C032820,Wrong,Offensive,"Political insult implying violent partisan reaction, not group hate"
C032822,Wrong,Safe,"Mild mocking comment about dance, not offensive"
C032825,Wrong,Safe,"Praise for movie, no hate"
C032827,Wrong,Safe,Neutral question about remake
C032831,Correct,,Vulgar insult at director
C032832,Wrong,Safe,"Population control opinion, no hate"
C032836,Wrong,Safe,"Fan comment about luck, no hate"
C032838,Wrong,Threat,Vulgar explicit threat pattern directed at another movie
C032839,Unsure,,"Unclear phrase, meaning unclear"
C032848,Wrong,Safe,"Fan war comparison comment, no hate"
C032853,Wrong,Safe,"Mild complaint about thumbnails, no hate"
C032857,Wrong,Safe,Neutral question about release order
C032858,Correct,,Dehumanizing insult at actor
C032861,Wrong,Safe,Neutral critique about trailer vs teaser
C032865,Correct,,Insult calling someone mad/loafer
C032881,Wrong,Offensive,"Vulgar insult about cricketer's performance, not group hate"
C032882,Wrong,Safe,"Anti-caste-discrimination social commentary, despite vulgar language not hate itself"
C032887,Wrong,Offensive,"Advocacy for women's awareness with dehumanizing insult at perpetrators, not protected-group hate"
