comment_id,language,category,comment,english_translation,severity,sentiment,toxicity_score,flag_reason,reviewer_verdict,corrected_category
C013364,Tamil,Hate Speech,"ஆண்ட சாதியாம்ல ஆமா இவனுங்க அமைச்சனுங்க, சட்டமன்ற உறுப்பினருங்க எல்லாம் போய் ஒரு பொம்பல கால்ல விழுந்தது யாருடா... \r பெத்தவள அம்மான்னு சொல்லி கூப்பிட்டிங்க ஒகே ஆனா அந்த பொம்பளய என்ன சொன்னிங்க \r நீங்க எல்லாம் திருந்த மாட்டீங்க....",,High,Negative,0.87,random baseline (calibration),,
C054888,Roman Telugu,Offensive,"Nijam cheppalante, Nee comments chadivithe thalanoppi vastundi Gurthu pettuko. 😢","honestly, reading your comments gives me a headache remember this.",Medium,Negative,0.5,random baseline (calibration),,
C009399,Kanglish,Offensive,A hu niamman kalskodu keydu kolve baavi madi kalsthini olike eldu snana madkollivanthe thuldeepannan pans for a reason caste dogs 🤣,,Medium,Negative,0.63,random baseline (calibration),,
C008863,Tanglish,Hate Speech,Thalaivaa Padam eduththu thaalichadu paththaathunnh thalaivi padam eduththu sambavam panna vanthirukkan Director!,,High,Negative,0.89,random baseline (calibration),,
C062468,Roman Telugu,Hate Speech,"Nijam cheppalante, Adavallaki nijanga samanatvam akkarledu, prathyeka sadupayale kavali Nammu nannu. smh","honestly, women don't really want equality, they just want special treatment trust me.",High,Neutral,0.75,sentiment=Neutral but category=Hate Speech,,
C064134,Roman Telugu,Offensive,Inta chettha video eppudu chudaledu Anthe.,never seen such a trash video that's it.,Medium,Neutral,0.58,sentiment=Neutral but category=Offensive,,
C068812,Roman Telugu,Offensive,"Mava, Nuvvu maatladeముందు kaastha aalochinchu Nammu nannu. ??","bro, think a little before you speak trust me.",Medium,Neutral,0.53,sentiment=Neutral but category=Offensive,,
C074244,Roman Telugu,Hate Speech,"Chudu, Adavallu social media-lo undakudadu Idi final. 😤","look, women shouldn't even be on social media this is final.",High,Neutral,0.67,sentiment=Neutral but category=Hate Speech,,
C056149,Roman Telugu,Hate Speech,"Chudu, Ilanti adavalla valle magavallu badhapadedi Seriously-ga. 🔥","look, it's because of women like these that men suffer seriously.",High,Negative,0.64,random baseline (calibration),,
C054676,Roman Telugu,Offensive,Nee level chuste jaaliga undi Seriously-ga. 😢,seeing your level is honestly pitiful seriously.,Medium,Neutral,0.52,sentiment=Neutral but category=Offensive,,
C041140,Tanglish,Hate Speech,Trailer 4.00 mins🤦 padamey upload panirukalam,,High,Negative,0.86,random baseline (calibration),,
C074284,Roman Telugu,Offensive,"Okka maata, Nuvvu maatladedi eppudu artham lekunda untundi Idi final.","one thing, what you say never makes any sense this is final.",Medium,Neutral,0.41,sentiment=Neutral but category=Offensive,,
C066911,Telugu,Offensive,"మావా, ఇంత చెత్త వీడియో ఎప్పుడూ చూడలేదు నమ్ము నన్ను. 😡","bro, never seen such a trash video trust me.",Medium,Neutral,0.36,sentiment=Neutral but category=Offensive,,
C050444,Roman Telugu,Offensive,"Hey, Evadu adigadu nee opinion","hey, who asked for your opinion",Medium,Neutral,0.51,sentiment=Neutral but category=Offensive,,
C074940,Roman Telugu,Hate Speech,"Urike cheptunna, Vallu maatladedi vinadam kuda time waste Idi nijam. 😡","just saying, even listening to what they say is a waste of time this is true.",High,Neutral,0.66,sentiment=Neutral but category=Hate Speech,,
C017806,Kannada,Hate Speech,ಶೆಟ್ಟಿಗಳು ಎಲ್ಲಾ ಈತರ ಕಥೆ ತೆಗಿಯೋದು ಮುಖ್ಯವಲ್ಲ ಕಮರ್ಷಿಯಲ್ ಸಿನಿಮಾ ಮಾಡಿ ತೋರಿಸಿ,,High,Negative,0.85,random baseline (calibration),,
C037097,Kannada,Offensive,ಏನ ನಿಂದು ಮುಕುಳ್ಯ,,Medium,Negative,0.57,random baseline (calibration),,
C055609,Roman Telugu,Hate Speech,"Urike cheptunna, Ee generation adavallu respect ivvadaniki asalu arhulu kaadu Nijanga. 🙄","just saying, this generation of women don't even deserve respect really.",High,Neutral,0.62,sentiment=Neutral but category=Hate Speech,,
C063023,Roman Telugu,Offensive,"Chudu, Ilanti chettha aalochanalu ekkada nerchukunnav Idi nijam.","look, where did you learn such trashy thinking this is true.",Medium,Neutral,0.37,sentiment=Neutral but category=Offensive,,
C032074,Kanglish,Hate Speech,Hate the dislikers .If it is true like me,,High,Negative,0.89,random baseline (calibration),,
C009295,Kannada,Offensive,ಅವನೇ ಶ್ರೀಮಾನ್ ನಾರಾಯಣ .. ಕುಡುಕನ ವರ್ಷನ್..nnಹೇ.. ನಿಮ್ಮನ್ನೆಲ್ಲ ಯಾರೋ ಒಳಾಗ್ ಬಿಟ್ಟಿದ್ದೂ..nnನನ್ ಮುಖ ನೋಡಿ ಕೇಳ್ತಿದೀಯಾnnಬೋರ್ಡು ಕಾಣುಸ್ತಾ ಇಲ್ವಾ,,Medium,Negative,0.58,random baseline (calibration),,
C074822,Roman Telugu,Hate Speech,"Mava, Ilanti adavalla valle magavallu badhapadedi Seriously-ga. #WomenSafety","bro, it's because of women like these that men suffer seriously.",High,Neutral,0.58,sentiment=Neutral but category=Hate Speech,,
C028084,Kannada,Offensive,Parthasarathi ನಿಮ್ಮ ಅಕ್ಕುನ್,,Medium,Negative,0.59,random baseline (calibration),,
C060723,Roman Telugu,Hate Speech,"Urike cheptunna, Vellandaru chesedi kevalam drama-ne Gurthu pettuko. 🔥","just saying, all they do is drama remember this.",High,Neutral,0.85,sentiment=Neutral but category=Hate Speech,,
C016482,Kannada,Hate Speech,ಜನರನ್ನು ಮೂರ್ಖರನಗಿಸೋ ವಿಡಿಯೋ ಇದು ಯಾರೂ ಕೂಡ ನಂಬಬೇಡಿ ಒಬ್ಬ ವ್ಯಕ್ತಿ 5000 ವರ್ಷ ಬದುಕುವುದು ಸಾಧ್ಯವಾ ನಿಮ್ಮಗೆ ನೀವೇ ಪ್ರಶ್ನೆ ಮಾಡಿಕೊಳ್ಳಿ.,,High,Negative,0.83,random baseline (calibration),,
C071187,Roman Telugu,Hate Speech,"Urike cheptunna, Vallaki eppudu edo oka complaint untundi anthe Nammu nannu. 😔","just saying, they always have some complaint or the other, that's it trust me.",High,Neutral,0.59,sentiment=Neutral but category=Hate Speech,,
C025172,Tanglish,Offensive,petta vs viswasam old vs new I prefer old... rare diamond,,Medium,Negative,0.63,random baseline (calibration),,
C072454,Telugu,Hate Speech,"వీళ్ళందరూ ఒక్కటే, అటెన్షన్ కోసమే ఇదంతా చేస్తారు ఓకే నా? ??","they're all the same, doing all this just for attention ok?",High,Neutral,0.8,sentiment=Neutral but category=Hate Speech,,
